Session_ID,Time_Record,Transcription,Sentiment,Valence,Activation,Dominance,discrete
Ses03M_impro06_M010,[082.6990-088.6860]:,You know a stupid case of drunk driving it's just...,sad,2.0,2.0,3.0,3
Ses03M_impro06_M011,[088.9294-094.2593]:,"and the worst part of it is that he was in the car with his girlfriend,",sad,2.0,2.5,3.5,3
Ses03M_impro06_M012,[094.3324-097.4719]:,his girlfriend got killed too.,sad,1.5,3.0,3.0,3
Ses03M_impro06_F008,[096.6931-098.8348]:,Oh man.,sad,1.5,2.5,3.5,3
Ses03M_impro06_M013,[097.5449-100.9765]:,And the car that he hit was his family.,sad,2.0,2.5,3.5,3
Ses03M_impro06_F009,[100.1004-103.1912]:,How are they?,sad,2.0,2.0,3.0,3
Ses03M_impro06_M014,[103.0452-106.1847]:,The mother and father died--,sad,2.0,3.0,3.5,3
Ses03M_impro06_M015,[106.3064-111.1739]:,and the kids are paralyzed in a coma right now.,sad,2.0,2.5,3.0,3
Ses03M_impro06_M016,[112.0501-116.6986]:,and just going to the funeral it's-,sad,2.5,3.0,3.5,3
Ses03M_impro06_M017,[117.0150-121.9555]:,"-do I miss him or do I hate him, you know?",sad,1.5,3.0,4.5,3
Ses03M_impro06_F010,[123.8051-132.2016]:,Yeah.  Like I mean if you need anyone to talk to or anything I'm here for you okay?,sad,3.5,2.5,3.5,3
Ses03M_impro06_F011,[132.9074-136.8014]:,We're all here for you.,sad,3.0,2.5,4.0,3
Ses03M_impro06_M018,[137.9453-142.8858]:,I was supposed to see him last summer,sad,2.5,2.0,3.0,3
Ses03M_impro06_M019,[143.6889-152.0367]:,then I got busy with work and stuff and three years go by,sad,2.5,2.5,4.0,3
Ses03M_impro06_M020,[152.3044-156.2958]:,and then something like this happens you know?,sad,2.5,1.5,3.5,3
Ses03M_impro06_M021,[156.4905-161.4797]:,I mean I haven't even talked to him on the phone for the past three months.,sad,2.5,3.0,3.5,3
Ses03M_impro06_M022,[161.7717-164.8139]:,He's supposed to be my best friend.,sad,2.0,2.0,3.5,3
Ses03M_impro06_F012,[164.0351-166.3472]:,I know.,sad,3.0,2.0,3.0,3
Ses03M_impro06_F013,[167.9048-175.1087]:,just things happen in life and you just...there's just no explanation you know?  We just don't...,sad,2.5,3.0,3.5,3
Ses03M_impro06_M023,[175.1087-178.2726]:,It's so fucked up.,sad,2.0,1.5,3.5,3
Ses03M_impro06_F014,[177.1044-179.2704]:,Yeah.,sad,2.0,2.5,3.0,3
Ses03M_impro06_F015,[180.8037-182.9697]:,I'm so sorry.,sad,2.0,2.0,3.5,3
Ses03M_impro06_M024,[182.0206-184.6003]:,Why is that?,sad,3.0,3.5,2.5,3
Ses03M_impro06_M025,[185.4522-189.8573]:,He was studying to be a doctor.,sad,3.0,2.0,3.5,3
Ses03M_impro06_M026,[190.0520-199.5193]:,"I mean he was...he wanted to help people in poor countries, that is his goal.  He didn't care about the money.  He just wanted to go and help people.",sad,2.5,3.0,4.0,3
Ses03M_impro06_M027,[199.6100-204.8248]:,What the...what am I doing?,sad,2.5,2.5,3.0,3
Ses03M_impro06_M028,[204.8979-208.8892]:,Working for corporate America?  Wow.,sad,2.5,3.0,3.5,3
Ses03M_impro06_M029,[209.0109-212.8562]:,He actually wanted to do something.,sad,2.5,3.0,3.5,3
Ses03M_impro06_F016,[212.9536-219.8655]:,"Well now you can follow his footsteps, you know?  Carry out what he wanted to do.",sad,3.0,2.5,2.5,3
Ses03M_impro06_M030,[219.2327-221.3744]:,I can't do that.,sad,2.5,2.0,3.0,3
Ses03M_impro06_F017,[220.2792-223.6378]:,Well sure you could.,sad,3.5,2.5,3.5,3
Ses03M_impro06_M031,[224.3922-226.9233]:,You should've met him.,sad,2.5,2.5,3.0,3
Ses03M_impro06_M032,[227.0694-229.3084]:,He is the greatest...everyone liked him.,sad,2.5,2.5,3.5,3
Ses03M_impro06_F018,[228.6513-230.6713]:,Yeah.,sad,2.5,2.5,3.0,3
Ses03M_impro06_F019,[231.9856-234.9547]:,I would've loved to.,sad,2.5,2.0,3.0,3
Ses03M_impro06_F020,[240.3577-244.3490]:,Now I can't.,sad,1.5,1.5,4.0,3
Ses03M_impro07_F000,[005.4500-007.9800]:,Hey.  How's it going?  I haven't seen you in awhile.,hap,4.0,3.5,3.0,4
Ses03M_impro07_F001,[009.6400-011.6000]:,What's going on Joe?,hap,4.0,3.0,3.0,4
Ses03M_impro07_M002,[012.4200-017.0000]:,Guess who got into U.S.C.?,exc,5.0,5.0,2.0,6
Ses03M_impro07_M003,[017.1400-021.0000]:,"Me. Yeah, I did.",exc,5.5,5.0,2.0,6
Ses03M_impro07_F003,[018.7700-024.8350]:,No way. Are you serious? Oh my God.  Congratulations. I'm so excited.,sur,4.5,4.0,3.5,5
Ses03M_impro07_M004,[021.0400-022.4100]:,Yeah.,exc,5.0,5.0,2.0,6
Ses03M_impro07_M005,[022.6300-024.5200]:,I got into the...,exc,5.0,4.5,1.5,6
Ses03M_impro07_M006,[024.5925-027.4100]:,I got into cinema production.,exc,5.0,4.5,2.0,6
Ses03M_impro07_F004,[026.9100-029.8300]:,No.  You didn't get into production.  There's no way.,sur,2.5,4.0,3.5,5
Ses03M_impro07_M007,[027.9125-028.4975]:,Yeah.,exc,5.0,5.0,2.0,6
Ses03M_impro07_M008,[029.4200-033.3400]:,No.  It's like it's harder than getting into Harvard.,exc,4.5,5.0,2.0,6
Ses03M_impro07_F005,[031.6400-038.7100]:,I know.  Oh my God.  Oh my God Joe I am so happy for you.  Well you know what that means?,sur,4.0,4.0,4.0,5
Ses03M_impro07_M009,[038.2700-039.7700]:,What does that mean?,neu,5.0,4.0,1.5,0
Ses03M_impro07_F006,[039.2800-045.7250]:,You're going to be here and I'm going to be in LA so we can be together now.  I mean we can be in the same city.,exc,5.0,4.5,4.5,6
Ses03M_impro07_M010,[045.4700-047.1500]:,Holy shit...,exc,5.5,5.0,2.0,6
Ses03M_impro07_F007,[045.9200-048.3600]:,We can party.  We can have fun.,exc,4.5,4.0,4.0,6
Ses03M_impro07_M011,[047.9100-050.9600]:,This will be like high school but even better.,exc,5.0,5.0,1.5,6
Ses03M_impro07_F008,[050.6200-053.0600]:,Yeah.  Hopefully it won't be like high school.,hap,4.0,3.0,3.0,4
Ses03M_impro07_F009,[053.8100-060.6400]:,"Oh man I am so proud of you, that is...how did you get...I mean what did you do?  How did you find out or what...?",exc,4.0,4.0,4.0,6
Ses03M_impro07_M013,[066.6200-074.8200]:,"I have some bad news.  I was like what?  She's like not really you got into U.S.C. and I was like, I was like oh my God.  I was about to tear my own hair out.",exc,5.5,5.0,2.0,6
Ses03M_impro07_F010,[073.7000-075.2550]:,Oh man.,hap,3.5,3.0,2.5,4
Ses03M_impro07_M014,[074.8900-081.2600]:,Yeah.  This is so crazy.  I mean I didn't get into any other school but I got into the school I wanted.,hap,5.0,4.5,2.0,4
Ses03M_impro07_F011,[081.0000-085.0700]:,Did you say yes yet?  I mean have you sent in your answer?,hap,3.0,3.5,3.0,4
Ses03M_impro07_M015,[083.7000-087.6600]:,Oh my God the first minute I got it I sent it back in.,exc,5.0,4.5,2.0,6
Ses03M_impro07_F012,[086.7700-088.3700]:,All right.,hap,3.5,3.5,2.5,4
Ses03M_impro07_M016,[087.8200-089.5900]:,So...,exc,5.0,4.5,1.5,6
Ses03M_impro07_F013,[088.9900-097.0000]:,"This is so great, you know, because I gone fit on downtown so I'm going to be like right here.  I think I'm going to be living at City Lights downtown.",hap,4.0,3.0,3.0,4
Ses03M_impro07_M017,[095.4700-099.1500]:,This is so exciting.  This is like a new chapter in our lives.,exc,5.0,4.5,1.5,6
Ses03M_impro07_F014,[098.7800-101.5500]:,"Yeah, it really is.",hap,3.5,3.0,2.5,4
Ses03M_impro07_M018,[100.0200-107.6300]:,"We're doing what we want to do, then four years later we're going to be working professionals, making money, sipping martinis every day.",exc,5.0,4.5,1.5,6
Ses03M_impro07_F016,[107.7400-111.6400]:,Man I'm just so happy for you.  I just--,exc,4.0,3.0,3.0,6
Ses03M_impro07_M019,[111.1900-112.7800]:,Thank you,exc,5.0,4.5,1.5,6
Ses03M_impro07_F017,[111.9100-116.2700]:,"Well, I'm happy for you but I'm happy for me cause that means you're going to stay.",hap,4.0,4.0,3.5,4
Ses03M_impro07_M020,[115.6500-121.0500]:,And tonight my parents want to take me out to sushi and they said I could bring you.,exc,5.0,5.0,2.0,6
Ses03M_impro07_F018,[120.7100-124.1100]:,Oh great. I would love to go.,exc,4.0,4.0,3.5,6
Ses03M_impro07_M022,[123.2600-127.0700]:,Yeah and they said get whatever you want and...,exc,5.0,5.0,2.0,6
Ses03M_impro07_F019,[125.5100-127.8500]:,Mmmm some miso soup.,hap,4.0,3.5,3.0,4
Ses03M_impro07_M023,[127.2800-132.4475]:,Some miso soup.  You can get whatever.  You can get a vat full of miso soup.  God.,exc,5.0,5.0,2.0,6
Ses03M_impro07_M024,[132.8900-135.3800]:,This is going to be so great.  I have so many great ideas.,exc,5.0,5.0,2.0,6
Ses03M_impro07_M025,[140.9100-149.5600]:,"It took them, oh man, it took them like, I mean what it's like April now and any letters that come in April are usually the rejection letters so I was just like...",hap,4.5,5.0,1.5,4
Ses03M_impro07_F023,[150.9700-154.2600]:,Oh my God.  I am so proud of you.,neu,4.5,4.5,1.5,0
Ses03M_impro08a_M000,[006.5663-011.4367]:,Hello.  This is Viacom Services.  How can I help you?,neu,3.0,3.0,2.5,0
Ses03M_impro08a_F000,[010.7663-018.3382]:,"Hello?  God finally somebody, look, this is ridiculous.  I've been waiting online for like a half an hour now.",fru,1.5,4.0,4.5,1
Ses03M_impro08a_M001,[017.6481-020.8228]:,"I'm sorry ma'am, what can I help you with?",neu,3.0,2.0,3.0,0
Ses03M_impro08a_F001,[019.8763-026.9925]:,"Look my, my phone isn't working.  I don't understand what's going on.  I am trying to call out.  I'm not receiving any calls",fru,2.0,3.5,4.0,1
Ses03M_impro08a_F002,[027.0735-031.6225]:,"and I need assistance with my...not only is my work phone, it's my home phone and look,",fru,2.0,4.5,4.0,1
Ses03M_impro08a_F003,[031.7275-036.8342]:,this is my business.  This is how I make money is through my phone.  It needs to be working.  Can you please help me?,fru,1.0,4.5,4.0,1
Ses03M_impro08a_M002,[034.1722-042.0202]:,Okay.  Can you give me the last four digits of your social security number so I can verify who I'm speaking with?,neu,3.0,2.5,3.5,0
Ses03M_impro08a_F004,[041.3695-044.4061]:,two two six six.,neu,2.5,2.0,2.0,0
Ses03M_impro08a_M003,[043.4794-046.8315]:,Okay.  And your name is?,neu,3.0,2.5,3.0,0
Ses03M_impro08a_F005,[045.9836-048.5076]:,Olivia.,fru,3.5,3.0,2.5,1
Ses03M_impro08a_M004,[047.7977-053.2597]:,Olivia. Um. Okay.  So how long has this problem been?,neu,3.0,3.5,3.5,0
Ses03M_impro08a_F006,[052.5302-061.8176]:,"This has been going on for the past two weeks.  I called every single day.  Nobody is helping me.  You guys tell me the same thing over and over, call again, call again, call again--",fru,1.0,4.5,4.5,1
Ses03M_impro08a_M005,[060.1218-062.9021]:,So what exactly is the problem?,neu,2.5,2.5,3.0,0
Ses03M_impro08a_F007,[061.8767-069.4487]:,"I don't, I don't know what the problem is.  That's what I want you guys to...why is my service not turned on?  And I paid my bills on time.  I don't understand.",fru,1.0,4.5,5.0,1
Ses03M_impro08a_M006,[068.6402-077.5530]:,Um- I think part of it has to do with the network being down.  It's been having some trouble the last few weeks--,neu,2.5,2.5,3.5,0
Ses03M_impro08a_F008,[074.8318-081.1900]:,"Okay.  Well that is, that is fine and all.  I don't care.  I really don't care because I want my phone to work that's all.",fru,2.0,4.0,4.5,1
Ses03M_impro08a_F009,[081.2225-092.2433]:,"That is I am paying you guys for service and I'm not getting any service.  I get, I get just dropped calls all the time and now it's completely not working at all.  I can't even call out, nine one one probably wouldn't even work.",fru,1.5,5.0,5.0,1
Ses03M_impro08a_M007,[087.7474-090.4292]:,I understand--we're not-,neu,3.0,2.5,3.0,0
Ses03M_impro08a_M008,[091.0602-095.6349]:,No.  Okay.  We're not charging you for any of these months.  We're going to give you three months free.,neu,3.0,2.0,3.0,0
Ses03M_impro08a_F010,[094.6884-099.7560]:,Well you better.  You better give me a whole freaking new phone that's what you better do.,fru,1.5,3.5,4.5,1
Ses03M_impro08a_M009,[098.8687-101.6293]:,We can give you a new phone--,neu,3.5,3.0,2.5,0
Ses03M_impro08a_F011,[099.9335-102.3589]:,I want a camera phone actually.,fru,2.0,4.0,4.5,1
Ses03M_impro08a_M010,[101.7279-107.3871]:,We can do that.  We can do that.  You just have to sign a one-year contract though with the--,neu,3.0,3.5,3.5,0
Ses03M_impro08a_F012,[105.5533-110.1575]:,"No, no, no...  I'm done with these contract business because this is what can happen.",fru,2.0,4.0,4.5,1
Ses03M_impro08a_F013,[110.2000-117.8182]:,"You sign the contract and then down the line the phone doesn't work and you're stuck, you can't go to a new...no.  No contracts for me.  You give me a new phone.",ang,1.5,4.0,4.5,2
Ses03M_impro08a_M011,[116.2210-122.3732]:,"Besides, it's sort of out of hands at the moment----The whole electrical power outage.",fru,2.0,3.5,3.0,1
Ses03M_impro08a_F014,[118.4295-121.2295]:,I want to talk to a supervisor,ang,2.0,3.5,4.0,2
Ses03M_impro08a_F015,[121.3084-126.2775]:,I would like to talk to your supervisor.  Obviously you're incompetent and don't understand what I'm asking.,ang,1.5,3.0,5.0,2
Ses03M_impro08a_M012,[125.5676-133.9480]:,"Um- Let me connect you to my supervisor.  Actually, he's out right now so I'm supervisor until he comes back. Um-",neu,3.0,4.0,4.0,0
Ses03M_impro08a_F016,[132.0353-134.4212]:,What?,fru,1.5,3.5,3.5,1
Ses03M_impro08a_M013,[134.2043-140.4156]:,"So you could----speak with me some more, you could call back later on maybe.",neu,3.0,3.0,4.0,0
Ses03M_impro08a_F017,[134.4804-137.0635]:,That's ridiculous.  You know?,fru,2.0,3.0,4.0,1
Ses03M_impro08a_F018,[138.8579-146.9819]:,"No I don't want to call back, you put me on hold for like hours and hours----and it's money, money, money, money and out of my pocket, out of my pocket--",fru,1.0,4.5,5.0,1
Ses03M_impro08a_M014,[141.8945-144.4579]:,I didn't put you on hold.,fru,2.5,3.0,3.0,1
Ses03M_impro08a_M015,[144.5565-150.0974]:,There are a lot of people calling us having problems.  Every phone company is having the same problems ma'am,fru,2.0,3.0,4.0,1
Ses03M_impro08a_F019,[149.4664-152.4439]:,Every phone...every single phone company?,fru,1.5,3.5,4.5,1
Ses03M_impro08a_M016,[151.3989-157.4327]:,"Mmm hmmm.  Mmm hmmm.  The power outages, everything, hurricane Katrina. Everything's really messed up.",neu,2.0,3.0,3.5,0
Ses03M_impro08a_F020,[154.2778-158.6553]:,This is ridiculous.Well what are we supposed to do?  We starve then because I can't use my phone cause,ang,2.0,3.5,4.5,2
Ses03M_impro08a_F021,[158.6750-166.4244]:,"I am a realtor and this is my business.  People are calling me all the time but you know, and I don't have a land line.  I can't afford to have a land line",ang,1.5,4.5,4.5,2
Ses03M_impro08a_M017,[162.1454-164.3145]:,don't you-,neu,3.0,2.0,2.5,0
Ses03M_impro08a_M018,[165.8131-170.0329]:,I'm really sorry ma'am.  There's not----a lot we can do for it.,neu,2.5,2.5,3.0,0
Ses03M_impro08a_F022,[167.5680-169.7174]:,That you better be sorry.,ang,2.0,3.0,4.0,2
Ses03M_impro08a_F023,[169.7568-173.6019]:,Well you're not helping me at all.  God this is so frustrating.,fru,1.5,3.5,4.5,1
Ses03M_impro08a_M019,[171.3737-181.1935]:,"What I can do for you, if you want to make a call right now I could contact you through our computer.  I can call through my phone and you can speak through me.",neu,3.0,3.0,3.5,0
Ses03M_impro08a_F024,[180.0104-183.8753]:,What?  No.  That's way too complicated.  Look--,fru,1.5,3.0,3.5,1
Ses03M_impro08a_F025,[183.8875-188.0359]:,you need to fix my phone.  I don't care what you have to do--,fru,1.5,4.0,4.5,1
Ses03M_impro08a_M020,[185.9851-190.8753]:,I'm sorry it has to do with an electrical power outage and stuff--,neu,2.0,3.0,3.5,0
Ses03M_impro08a_M021,[196.2388-203.5544]:,"Well, okay I'm going to give you a free phone card that you can use at any payphone and that's on us. Okay?",neu,3.0,3.0,4.0,0
Ses03M_impro08a_F027,[201.0304-207.7347]:,"Yeah yeah, woman going out in South Central on the payphone at night.  Oh that's real safe.",fru,2.0,4.0,4.0,1
Ses03M_impro08a_M022,[206.9065-211.1854]:,"I'm, I'm sorry you chose to live there um--",neu,2.5,2.0,3.0,0
Ses03M_impro08a_F028,[209.8840-215.3575]:,"No, no, no.  I didn't choose to live here.  I work there.  Okay?  Yeah. work work work",fru,1.5,3.5,4.5,1
Ses03M_impro08a_M023,[214.8728-218.8559]:,Well I'm sure maybe there's a phone at work you could use.,neu,2.5,3.0,3.5,0
Ses03M_impro08a_F029,[218.1658-225.7180]:,"We can't call out.  We can't make out-- line.  I don't work, I work at another office.",fru,2.5,4.0,4.0,1
Ses03M_impro08a_F030,[225.7771-229.8392]:,A law firm.  Thank you very much.,fru,3.0,2.5,3.0,1
Ses03M_impro08a_M024,[227.9067-231.1406]:,All right um--,neu,3.0,3.5,2.5,0
Ses03M_impro08a_F031,[230.4899-239.5801]:,"I work out of my home as a realtor and because I don't have a land line, I need a phone and because of now I don't have one I don't know what to do.  And you're not helping me at all.",fru,2.0,5.0,4.5,1
Ses03M_impro08a_F032,[239.6393-242.9323]:,"In fact, give me your name sir, what's your name again?",fru,2.0,3.5,4.5,1
Ses03M_impro08a_M025,[242.3999-246.0675]:,My name is Sara.,neu,3.0,3.5,3.0,0
Ses03M_impro08a_F033,[245.3971-248.9070]:,Okay.  Sara what?,fru,2.5,2.5,3.5,1
Ses03M_impro08a_M026,[247.9999-250.6619]:,Sara Brown.,neu,3.0,2.0,3.0,0
Ses03M_impro08a_F034,[249.7746-262.7494]:,"Sara Brown.  Sara Brown, um- yeah, I'm going to get off the phone with you. And then I'm going to call back and I'm going to give your supervisor your name because you're obviously incompetent to work here.",fru,1.5,4.0,4.5,1
Ses03M_impro08a_M027,[261.2113-268.4283]:,"You know maam, we record this conversation so anything you say can be proven in a law of court so keep that in mind.",neu,2.5,2.5,4.0,0
Ses03M_impro08a_F035,[266.4367-274.7974]:,"What are you, what are you a police officer now?  You know, like I'm done, I'm over it.  Goodbye and I hope that you lose your job.",fru,1.5,4.0,4.5,1
Ses03M_impro08b_M000,[015.1200-017.5200]:,Hello?,neu,3.0,3.0,3.0,0
Ses03M_impro08b_F001,[017.5400-025.3200]:,Oh God I finally got...you know how long I've been waiting on line?  You put on hold for like five hours.  Geez.,fru,1.5,4.0,4.5,1
Ses03M_impro08b_M001,[024.1300-031.9200]:,I'm sorry ma'am.  What's the nature of your problem?  But first can I get you to tell me your first and last name?,neu,2.5,3.5,3.5,0
Ses03M_impro08b_F002,[030.8800-036.9400]:,I've already been through this five times with these people.  I've been calling every single day.,fru,1.5,3.5,4.5,1
Ses03M_impro08b_M002,[034.9200-039.0800]:,I know I just need to verify every time.  I'm sorry.,neu,2.5,2.5,3.0,0
Ses03M_impro08b_F003,[037.9400-042.0300]:,Olivia Brown.,fru,2.0,3.0,3.5,1
Ses03M_impro08b_M003,[042.0800-045.5900]:,Alright Ms. Brown what's the nature of your problem?,neu,3.0,2.5,3.0,0
Ses03M_impro08b_F004,[044.6900-049.2100]:,Well my phone isn't working and it hasn't been working for the last five days.,fru,1.5,4.5,4.5,1
Ses03M_impro08b_M004,[048.4800-052.7900]:,Oh.  I'm sorry. Um- Did you drop it in water?,neu,2.0,2.5,3.0,0
Ses03M_impro08b_F005,[049.6500-052.0100]:,"Yeah, yeah, yeah you better be sorry.",ang,1.5,3.5,4.0,2
Ses03M_impro08b_F006,[052.2600-058.7975]:,No I did not drop my phone in water.  I'm not five years old and just dropped my phone anywhere I see it.  Okay this is my business.,ang,1.5,2.5,4.0,2
Ses03M_impro08b_F007,[058.8600-065.3000]:,Okay?  And it [GARBAGE]. My business is failing because my phone isn't working and I don't have a land line and I really can't handle this right now.,fru,2.0,4.0,4.5,1
Ses03M_impro08b_M005,[064.7700-075.6700]:,"Um- well it's probably easy.  Can you any more symptoms either you're not receiving calls----ok, you're not receiving calls, not getting calls.",neu,3.0,3.0,4.0,0
Ses03M_impro08b_F008,[069.8200-077.4600]:,"the symptoms- This [GARBAGE] a doctor's office. I'm not receiving calls...I can't receive- no, it's, it cuts me off--",fru,1.5,3.5,4.5,1
Ses03M_impro08b_M006,[075.9800-078.5000]:,Is the phone turned on?,neu,2.5,2.5,3.5,0
Ses03M_impro08b_F009,[078.1800-083.7000]:,Yes the phone turns on.  No I mean I'm using it not turning on the phone.  Of course it turns on.,fru,1.5,3.5,4.0,1
Ses03M_impro08b_M007,[083.1500-088.9800]:,"Well, um- okay.  Your sim card is in- didn't fall out-",neu,2.5,3.0,3.5,0
Ses03M_impro08b_F010,[086.8700-093.3800]:,No- I don't have a sim card because it's Verizon and you guys don't use sim cards.,fru,2.0,3.5,4.5,1
Ses03M_impro08b_M008,[092.7300-098.3900]:,Alright.  Um- Well that could be the problem. cause--,neu,2.5,2.5,3.0,0
Ses03M_impro08b_M009,[098.5000-106.5000]:,you might have an older phone where we would use sim cards but probably not.,neu,3.0,3.0,3.0,0
Ses03M_impro08b_F011,[104.3900-114.7900]:,"Okay no.  Sir, this is the deal.  My phone isn't working and I don't care what the problem is but it needs to work.  That's why I'm paying you guys to fix it.",fru,1.5,4.0,4.5,1
Ses03M_impro08b_M010,[113.6800-122.8400]:,Okay.  How about this we'll send you a brand new camera phone with palm pilot-- and-,neu,3.0,3.5,4.0,0
Ses03M_impro08b_F012,[120.2600-126.6900]:,I don't know even how to use that stuff it's too complicated.  I just want my flip phone to work----that's all I need,fru,2.0,4.0,4.0,1
Ses03M_impro08b_M011,[123.0000-130.1900]:,"So we'll send it- And we'll give you, how about a free year's service?",neu,3.0,3.0,3.0,0
Ses03M_impro08b_F013,[127.6300-135.8600]:,"Look, I am on the road all the time.  Do you understand how important?  I'm a woman, a single mother by herself working...what?",fru,1.5,4.0,4.5,1
Ses03M_impro08b_M012,[132.6800-138.8500]:,Tell them my name.  My name is Brent Backersen.,neu,3.0,2.5,4.0,0
Ses03M_impro08b_F014,[138.3400-142.6100]:,"Brent Backersen, I am writing this down, Brent Backersen.  Alright.",fru,2.0,3.5,4.0,1
Ses03M_impro08b_M013,[142.1300-146.5100]:,Okay.  Tell them my - my ID number is two one three five.,neu,3.0,3.0,3.0,0
Ses03M_impro08b_M014,[146.5500-153.8300]:,"Tell them that.  You can go in, get a brand new phone, they'll hook you up with service even give you a free three months--",neu,3.0,2.5,4.0,0
Ses03M_impro08b_F015,[151.3900-155.5200]:,"I, I, I don't want a contract. Okay. I don't want any contracts.",fru,1.5,4.0,4.0,1
Ses03M_impro08b_M015,[154.7100-157.3900]:,It will be free.  No contract okay?,neu,2.5,3.5,4.0,0
Ses03M_impro08b_F016,[156.7200-158.3800]:,Really?  No contract?,fru,2.5,3.0,2.5,1
Ses03M_impro08b_M016,[157.4800-160.8700]:,"Go in there, yeah, go in there.  Tell them Brent Backersen sent you.",neu,3.0,3.0,3.0,0
Ses03M_impro08b_M017,[164.9700-170.8400]:,"the top of the line camera phone, game boy, anything you want. For free. And palm pilot.",neu,3.0,3.0,3.5,0
Ses03M_impro08b_M018,[174.5900-177.5000]:,They might only have orange.,neu,3.0,2.5,3.0,0
Ses03M_impro08b_M019,[178.1425-188.8300]:,"Okay.  They can figure out pink for you.  So go in there and just tell them that and they'll hook you up with other goodies, stuff like that free service, no contract, no nothing.  Just for being a good customer",neu,3.0,3.5,4.0,0
Ses03M_impro08b_M020,[188.8500-191.0600]:,and battling through with us.,neu,3.0,2.5,3.0,0
Ses03M_impro08b_F021,[192.1200-196.9100]:,"Alright. Well-  I guess - I guess that's okay but,",neu,2.5,3.0,3.0,0
Ses03M_impro08b_M021,[198.8200-201.9100]:,Yes.  You just tell them Brent Backersen sent you.,neu,3.0,2.5,3.0,0
Ses03M_impro08b_F023,[203.4325-204.7875]:,Okay.,neu,3.0,2.5,2.5,0
Ses03M_impro08b_M022,[204.3900-208.8800]:,Alright?  Great.  Have a nice evening.,neu,3.5,3.0,3.5,0
Ses03M_impro08b_F024,[207.0000-209.6600]:,Alright Thanks.,neu,4.0,2.5,2.5,0
Ses03M_script01_1_F000,[006.6092-011.7770]:,What's he going to say?  Maybe we ought to talk to him before he sees it.,neu,3.0,3.0,3.0,0
Ses03M_script01_1_M000,[011.4606-014.6773]:,He saw it.,sad,3.0,2.0,2.5,3
Ses03M_script01_1_F001,[014.5015-019.6517]:,"What do you mean. He couldn't have seen it. I was the first one up, he was still in bed.",sur,2.5,3.5,3.5,5
Ses03M_script01_1_M001,[019.2650-021.9192]:,He was out there when it happened.,sad,2.5,2.5,2.5,3
Ses03M_script01_1_F002,[021.3040-023.5188]:,When?,sur,2.0,3.5,3.0,5
Ses03M_script01_1_M002,[023.1025-032.3525]:,About four in the morning.  I heard a crack and I looked out and he was standing right there when it happened.,sad,3.0,2.5,3.0,3
Ses03M_script01_1_M003,[034.2060-040.1648]:,I don't know. But after it cracked he ran back into the house and he cried in the kitchen.,sad,2.5,2.5,3.0,3
Ses03M_script01_1_F004,[040.0593-042.3795]:,Did you talk to him?,sad,3.0,2.5,2.5,3
Ses03M_script01_1_M004,[041.7292-047.2837]:,No.  I figured the best thing to do was leave him alone.,sad,2.5,2.5,3.0,3
Ses03M_script01_1_F005,[047.5298-049.4985]:,He cried hard?,sad,3.0,2.5,2.5,3
Ses03M_script01_1_M005,[049.0414-051.4320]:,I could hear it right through the floor.,sad,2.0,2.5,3.0,3
Ses03M_script01_1_F007,[054.9651-059.2013]:,Starting to dream about him again.  He's walking around at night again.,fru,2.0,3.5,3.5,1
Ses03M_script01_1_M006,[058.7443-061.4160]:,I guess he is.,sad,3.0,2.0,2.5,3
Ses03M_script01_1_F008,[061.0118-066.7850]:,"He's getting just like he did after he died, you know?  What, what, what's the meaning of this?",sad,2.0,3.5,3.0,3
Ses03M_script01_1_M007,[066.2323-072.5602]:,"I don't know.  But I know one thing mom, we made a terrible mistake with dad.",sad,2.0,3.0,3.0,3
Ses03M_script01_1_M008,[073.2985-078.5718]:,Being dishonest with him.  That kind of thing always pays off and now it's paying off.,fru,3.0,3.5,4.0,1
Ses03M_script01_1_M009,[079.1870-087.9758]:,You know that Larry's not coming back and I know that too.  Why we both go on letting him think that we both believe with him.,ang,2.0,3.0,4.0,2
Ses03M_script01_1_M010,[090.0851-096.7118]:,"No I don't want to argue with him but, it's time that he realizes that nobody believes Larry's coming back anymore.",fru,2.0,3.5,4.0,1
Ses03M_script01_1_M011,[096.7470-110.3169]:,"Why shouldn't he walk around and dream at him at night.  Walk around.  Why shouldn't he walk around?  Why shouldn't he dream of him, walk around at night waiting for him?  Do we contradict him?  Do we say flat out that we don't have anymore hope?",ang,2.0,4.0,4.5,2
Ses03M_script01_1_M012,[110.3520-113.4632]:,That we haven't had any hope for years now?,ang,2.5,3.5,4.5,2
Ses03M_script01_1_F013,[117.0666-119.8625]:,How are you going to prove it?  Can you prove it?,fru,2.0,3.5,3.0,1
Ses03M_script01_1_M014,[119.4396-125.1699]:,Larry's been gone for three years.  For god sakes no one comes back after three years.  It's insane.,fru,1.5,4.0,4.5,1
