Session_ID,Time_Record,Transcription,Sentiment,Valence,Activation,Dominance,discrete
Ses03M_impro05a_M030,[162.7600-167.4425]:,now what are you going to do about it,exc,4.5,4.5,4.0,6
Ses03M_impro05b_F000,[005.2466-007.9300]:,can i help you sir,neu,3.0,2.0,2.5,0
Ses03M_impro05b_M001,[010.5900-016.9100]:,i ve been here for four hour and i don t know where one piece of my luggage is,fru,2.5,2.0,3.5,1
Ses03M_impro05b_F001,[015.9350-020.6125]:,okay well let s well i m going to go ahead and check on that for you you re coming from where are you coming from,neu,3.0,3.0,3.0,0
Ses03M_impro05b_M002,[020.2800-021.7200]:,baltimore,fru,2.5,2.5,3.0,1
Ses03M_impro05b_F002,[020.9400-023.4500]:,baltimore and this is a direct flight to lax,neu,3.0,2.5,3.5,0
Ses03M_impro05b_M003,[023.0900-024.4700]:,yes,fru,2.5,3.0,3.0,1
Ses03M_impro05b_F003,[023.9000-026.1500]:,okay let s look up here,neu,3.0,2.0,3.0,0
Ses03M_impro05b_M004,[025.8500-029.3500]:,you know and they ve looked it up before and it s not there,fru,2.0,3.0,4.0,1
Ses03M_impro05b_F004,[028.9100-030.6700]:,okay well you um,neu,3.0,3.0,2.5,0
Ses03M_impro05b_M005,[030.0900-033.0000]:,now what are you going to do for me different hmm,fru,2.5,2.0,4.0,1
Ses03M_impro05b_F005,[031.6400-038.2150]:,what i can do for you is uh we can uh report lost lost property,neu,3.0,3.0,2.5,0
Ses03M_impro05b_M006,[037.8600-040.1200]:,you can report lost property,fru,3.0,2.5,3.5,1
Ses03M_impro05b_F006,[039.7300-040.7700]:,yes,neu,3.0,3.0,2.5,0
Ses03M_impro05b_M007,[040.3100-051.4700]:,okay i m leaving la tomorrow for san diego driving there so i m going to leave without all my lost property that s what you want me to do um,fru,1.5,3.0,4.5,1
Ses03M_impro05b_F007,[050.0900-055.8900]:,well sir if if what i believe ha happened is most of the flight wa left,neu,3.0,3.0,2.5,0
Ses03M_impro05b_F008,[055.9100-058.6350]:,the luggage wa left in baltimore therefore,neu,3.0,3.0,3.0,0
Ses03M_impro05b_M008,[058.3200-060.0600]:,most of the,ang,1.5,3.0,4.5,2
Ses03M_impro05b_F009,[059.7475-062.1500]:,like the luggage the luggage on the flight,neu,3.0,3.5,2.5,0
Ses03M_impro05b_F010,[064.0600-068.1600]:,no actually it wa this is the first time this ha ever happened i don t know what happened,neu,2.5,3.5,3.5,0
Ses03M_impro05b_M010,[066.7200-072.4400]:,are you going to refund u for our luggage refund u for our ticket for this,fru,1.5,2.5,4.5,1
Ses03M_impro05b_F011,[071.0900-077.8100]:,well we can give you um hotel lodging for a night if that,neu,3.0,3.5,2.5,0
Ses03M_impro05b_M011,[076.2000-083.2200]:,i m going to san diego tomorrow to stay with my family what do i need hotel lodging for hmmm can you tell me that,ang,1.5,2.5,4.0,2
Ses03M_impro05b_F012,[081.5200-085.5000]:,for tonight for tonight sir would you need to stay somewhere tonight,neu,2.5,3.0,3.0,0
Ses03M_impro05b_F013,[092.3700-096.1700]:,we can do holiday inn or,neu,3.0,3.5,2.5,0
Ses03M_impro05b_M013,[095.2200-102.0400]:,wow thank you holiday inn wow thank the flight cost five hundred dollar,ang,1.5,4.0,4.5,2
Ses03M_impro05b_F014,[101.7600-103.8700]:,sir i understand that but just,neu,2.5,3.5,2.5,0
Ses03M_impro05b_M014,[102.0600-106.5400]:,okay so you can put me in holiday inn for twenty dollar a night,ang,1.5,3.5,4.5,2
Ses03M_impro05b_F015,[105.7400-108.7700]:,did you have your name tag on the luggage,neu,3.0,3.0,2.5,0
Ses03M_impro05b_M015,[108.2100-110.9500]:,of course i had my name tag on the luggage,ang,2.5,2.5,3.5,2
Ses03M_impro05b_F016,[110.0400-118.6800]:,okay so if you can just give me your name your name and your address and your phone number i can contact you a soon a we find out more information,neu,3.0,3.5,2.5,0
Ses03M_impro05b_M016,[117.0800-120.8000]:,soon a you that s not good enough okay,ang,1.5,4.0,4.5,2
Ses03M_impro05b_F017,[120.5400-124.2900]:,sir please calm down,fru,2.5,2.5,3.5,1
Ses03M_impro05b_M017,[123.9700-134.6925]:,i need you to help me out here can you get on the phone and get the luggage over on the fastest flight you can and then maybe i won t get you fired,fru,2.0,2.0,4.0,1
Ses03M_impro05b_M018,[134.7200-142.8700]:,if not i m going to get your name i m going to talk to your bos whoever i m never going to fly my business is never going to fly delta again,fru,2.0,3.0,4.5,1
Ses03M_impro05b_F018,[142.4700-144.3800]:,what is your business,neu,3.0,3.0,2.5,0
Ses03M_impro05b_M019,[144.2500-146.2150]:,i work for ibm,neu,3.5,3.0,3.5,0
Ses03M_impro05b_F019,[145.8000-153.1300]:,okay sir i am sorry to tell you this but this doe happen uh this is not uh really,neu,2.5,3.0,2.5,0
Ses03M_impro05b_F020,[153.1450-159.6100]:,i mean our airline s fault i don t know what happened misplaced something happened but we will get you,neu,2.5,3.5,2.5,0
Ses03M_impro05b_M020,[157.9700-161.9400]:,you misplace a lot of eight piece of luggage,ang,2.0,3.5,4.5,2
Ses03M_impro05b_F021,[161.4800-168.5800]:,well the entire flight sir the luggage wa placed on another plane that never actually left baltimore,neu,2.5,3.0,3.0,0
Ses03M_impro05b_F022,[168.5800-170.0400]:,uh no i m not,neu,2.5,2.5,2.5,0
Ses03M_impro05b_M021,[167.0800-168.8100]:,are you kidding me,ang,1.5,3.5,4.5,2
Ses03M_impro05b_M022,[169.0200-171.5000]:,who are you going to fire because of that,ang,1.5,4.0,4.5,2
Ses03M_impro05b_F023,[170.6100-177.5300]:,well we have some people back there that need some firing so but i would just really appreciate,neu,3.0,3.0,3.0,0
Ses03M_impro05b_M023,[174.2400-178.5400]:,wow this ha never happened before i ve not lost,ang,1.5,2.5,4.5,2
Ses03M_impro05b_M024,[178.5400-183.5225]:,in all thousand flight i ve been on probably i can t even count how many flight i ve been on this ha never happened before,ang,1.5,3.5,4.5,2
Ses03M_impro05b_M025,[183.5400-186.4500]:,this is the worst customer service i ve ever gotten before,ang,1.5,3.0,4.5,2
Ses03M_impro05b_F024,[186.0600-187.8600]:,okay sir i m sorry you can um,fru,2.5,2.5,2.5,1
Ses03M_impro05b_M026,[187.4300-192.3300]:,okay get on the phone and figure out where my luggage is and tell me when it s going to get there alright,ang,1.5,4.0,4.5,2
Ses03M_impro05b_F025,[191.1700-196.9500]:,we already have been confirmed that it will be arriving in uh in about two day,fru,3.0,3.0,2.0,1
Ses03M_impro05b_M027,[194.7100-197.0700]:,and and in about,ang,2.0,2.5,3.5,2
Ses03M_impro05b_M028,[197.2300-203.4700]:,two day i ll be in san diego and how s it going to get to me in san diego you going to make sure it get to the san diego airport,fru,2.0,3.5,4.0,1
Ses03M_impro05b_F026,[202.9500-205.0000]:,uh we can t,fru,3.0,2.0,2.0,1
Ses03M_impro05b_M029,[204.1400-213.0700]:,can you get it to the san diego airport you get someone to drive it to my place alright then i get a refund for some i get a free flight alright i get free whatever,ang,1.5,3.5,4.5,2
Ses03M_impro05b_F027,[207.7300-209.5300]:,yes sir yes,neu,2.5,2.5,1.5,0
Ses03M_impro05b_F028,[212.4800-215.7600]:,we can have them direct your luggage to san diego,neu,3.0,3.0,2.5,0
Ses03M_impro05b_M030,[215.1700-219.1500]:,okay and you re going to give me what for my inconvenience,fru,2.0,3.0,4.0,1
Ses03M_impro05b_F029,[218.8900-221.7100]:,uh,neu,3.0,2.5,2.0,0
Ses03M_impro05b_F030,[221.8475-225.0400]:,some refreshment in the lobby,neu,3.0,3.5,2.0,0
Ses03M_impro05b_M031,[224.3200-229.9900]:,some peanut wow that help a lot,ang,1.5,3.5,4.5,2
Ses03M_impro05b_M032,[230.0700-238.2200]:,thanks you thank you i don t have my luggage so you gave me a holiday inn stay and peanut wow you know what,ang,1.5,3.5,4.5,2
Ses03M_impro05b_F031,[233.0700-235.3100]:,eh we actually,fru,2.5,3.0,1.5,1
Ses03M_impro05b_M033,[238.4300-241.6100]:,i will never do business with delta again,ang,2.0,2.5,4.0,2
Ses03M_impro06_F000,[009.6133-014.6512]:,how s it going how are you feeling,sad,3.0,2.0,3.0,3
Ses03M_impro06_M000,[013.5804-016.6469]:,i ah,sad,3.0,2.0,2.5,3
Ses03M_impro06_M001,[017.2553-020.0055]:,alright,sad,3.5,2.5,2.5,3
Ses03M_impro06_F001,[019.2023-022.2932]:,hanging in there,sad,3.5,2.5,2.5,3
Ses03M_impro06_M002,[021.3927-024.4349]:,yeah,sad,2.5,2.0,3.0,3
Ses03M_impro06_F002,[027.9882-031.5658]:,so sad,sad,2.0,2.0,2.5,3
Ses03M_impro06_M003,[030.8844-035.1434]:,it just feel like i wa talking to him yesterday,sad,2.5,2.0,3.0,3
Ses03M_impro06_F003,[034.1943-036.7984]:,yeah,sad,3.0,2.0,2.5,3
Ses03M_impro06_F004,[036.8471-040.2300]:,you guy were real close huh,sad,2.0,2.0,3.0,3
Ses03M_impro06_M004,[040.1813-044.4160]:,he wa my only friend growing up,sad,2.5,2.5,3.5,3
Ses03M_impro06_M005,[044.4890-048.8941]:,no one else would talk to me but he would,sad,2.0,2.0,3.5,3
Ses03M_impro06_M006,[048.9915-053.5183]:,he wa supposed to be the best man at my wedding,sad,2.0,2.5,3.5,3
Ses03M_impro06_F005,[053.4939-057.3393]:,i m so sorry,sad,2.0,2.5,4.0,3
Ses03M_impro06_M007,[057.8747-060.7465]:,yeah,sad,2.5,3.0,3.0,3
Ses03M_impro06_M008,[060.8439-068.7049]:,you know i wa always the one to tell him to be more wild you know,sad,3.0,2.5,3.5,3
Ses03M_impro06_M009,[068.9240-074.4242]:,and he just took it overboard,sad,2.5,2.5,3.5,3
Ses03M_impro06_F007,[076.5173-082.7477]:,what happened what went wrong,sad,2.5,2.5,3.5,3
Ses03M_impro06_M010,[082.6990-088.6860]:,you know a stupid case of drunk driving it s just,sad,2.0,2.0,3.0,3
Ses03M_impro06_M011,[088.9294-094.2593]:,and the worst part of it is that he wa in the car with his girlfriend,sad,2.0,2.5,3.5,3
Ses03M_impro06_M012,[094.3324-097.4719]:,his girlfriend got killed too,sad,1.5,3.0,3.0,3
Ses03M_impro06_F008,[096.6931-098.8348]:,oh man,sad,1.5,2.5,3.5,3
Ses03M_impro06_M013,[097.5449-100.9765]:,and the car that he hit wa his family,sad,2.0,2.5,3.5,3
Ses03M_impro06_F009,[100.1004-103.1912]:,how are they,sad,2.0,2.0,3.0,3
Ses03M_impro06_M014,[103.0452-106.1847]:,the mother and father died,sad,2.0,3.0,3.5,3
Ses03M_impro06_M015,[106.3064-111.1739]:,and the kid are paralyzed in a coma right now,sad,2.0,2.5,3.0,3
Ses03M_impro06_M016,[112.0501-116.6986]:,and just going to the funeral it s,sad,2.5,3.0,3.5,3
Ses03M_impro06_M017,[117.0150-121.9555]:,do i miss him or do i hate him you know,sad,1.5,3.0,4.5,3
Ses03M_impro06_F010,[123.8051-132.2016]:,yeah like i mean if you need anyone to talk to or anything i m here for you okay,sad,3.5,2.5,3.5,3
Ses03M_impro06_F011,[132.9074-136.8014]:,we re all here for you,sad,3.0,2.5,4.0,3
Ses03M_impro06_M018,[137.9453-142.8858]:,i wa supposed to see him last summer,sad,2.5,2.0,3.0,3
Ses03M_impro06_M019,[143.6889-152.0367]:,then i got busy with work and stuff and three year go by,sad,2.5,2.5,4.0,3
Ses03M_impro06_M020,[152.3044-156.2958]:,and then something like this happens you know,sad,2.5,1.5,3.5,3
Ses03M_impro06_M021,[156.4905-161.4797]:,i mean i haven t even talked to him on the phone for the past three month,sad,2.5,3.0,3.5,3
Ses03M_impro06_M022,[161.7717-164.8139]:,he s supposed to be my best friend,sad,2.0,2.0,3.5,3
Ses03M_impro06_F012,[164.0351-166.3472]:,i know,sad,3.0,2.0,3.0,3
Ses03M_impro06_F013,[167.9048-175.1087]:,just thing happen in life and you just there s just no explanation you know we just don t,sad,2.5,3.0,3.5,3
Ses03M_impro06_M023,[175.1087-178.2726]:,it s so fucked up,sad,2.0,1.5,3.5,3
Ses03M_impro06_F014,[177.1044-179.2704]:,yeah,sad,2.0,2.5,3.0,3
Ses03M_impro06_F015,[180.8037-182.9697]:,i m so sorry,sad,2.0,2.0,3.5,3
Ses03M_impro06_M024,[182.0206-184.6003]:,why is that,sad,3.0,3.5,2.5,3
Ses03M_impro06_M025,[185.4522-189.8573]:,he wa studying to be a doctor,sad,3.0,2.0,3.5,3
Ses03M_impro06_M026,[190.0520-199.5193]:,i mean he wa he wanted to help people in poor country that is his goal he didn t care about the money he just wanted to go and help people,sad,2.5,3.0,4.0,3
Ses03M_impro06_M027,[199.6100-204.8248]:,what the what am i doing,sad,2.5,2.5,3.0,3
Ses03M_impro06_M028,[204.8979-208.8892]:,working for corporate america wow,sad,2.5,3.0,3.5,3
Ses03M_impro06_M029,[209.0109-212.8562]:,he actually wanted to do something,sad,2.5,3.0,3.5,3
Ses03M_impro06_F016,[212.9536-219.8655]:,well now you can follow his footstep you know carry out what he wanted to do,sad,3.0,2.5,2.5,3
Ses03M_impro06_M030,[219.2327-221.3744]:,i can t do that,sad,2.5,2.0,3.0,3
Ses03M_impro06_F017,[220.2792-223.6378]:,well sure you could,sad,3.5,2.5,3.5,3
Ses03M_impro06_M031,[224.3922-226.9233]:,you should ve met him,sad,2.5,2.5,3.0,3
Ses03M_impro06_M032,[227.0694-229.3084]:,he is the greatest everyone liked him,sad,2.5,2.5,3.5,3
Ses03M_impro06_F018,[228.6513-230.6713]:,yeah,sad,2.5,2.5,3.0,3
Ses03M_impro06_F019,[231.9856-234.9547]:,i would ve loved to,sad,2.5,2.0,3.0,3
Ses03M_impro06_F020,[240.3577-244.3490]:,now i can t,sad,1.5,1.5,4.0,3
Ses03M_impro07_F000,[005.4500-007.9800]:,hey how s it going i haven t seen you in awhile,hap,4.0,3.5,3.0,4
Ses03M_impro07_F001,[009.6400-011.6000]:,what s going on joe,hap,4.0,3.0,3.0,4
Ses03M_impro07_M002,[012.4200-017.0000]:,guess who got into u s c,exc,5.0,5.0,2.0,6
Ses03M_impro07_M003,[017.1400-021.0000]:,me yeah i did,exc,5.5,5.0,2.0,6
Ses03M_impro07_F003,[018.7700-024.8350]:,no way are you serious oh my god congratulation i m so excited,sur,4.5,4.0,3.5,5
Ses03M_impro07_M004,[021.0400-022.4100]:,yeah,exc,5.0,5.0,2.0,6
Ses03M_impro07_M005,[022.6300-024.5200]:,i got into the,exc,5.0,4.5,1.5,6
Ses03M_impro07_M006,[024.5925-027.4100]:,i got into cinema production,exc,5.0,4.5,2.0,6
Ses03M_impro07_F004,[026.9100-029.8300]:,no you didn t get into production there s no way,sur,2.5,4.0,3.5,5
Ses03M_impro07_M007,[027.9125-028.4975]:,yeah,exc,5.0,5.0,2.0,6
Ses03M_impro07_M008,[029.4200-033.3400]:,no it s like it s harder than getting into harvard,exc,4.5,5.0,2.0,6
Ses03M_impro07_F005,[031.6400-038.7100]:,i know oh my god oh my god joe i am so happy for you well you know what that mean,sur,4.0,4.0,4.0,5
Ses03M_impro07_M009,[038.2700-039.7700]:,what doe that mean,neu,5.0,4.0,1.5,0
Ses03M_impro07_F006,[039.2800-045.7250]:,you re going to be here and i m going to be in la so we can be together now i mean we can be in the same city,exc,5.0,4.5,4.5,6
Ses03M_impro07_M010,[045.4700-047.1500]:,holy shit,exc,5.5,5.0,2.0,6
Ses03M_impro07_F007,[045.9200-048.3600]:,we can party we can have fun,exc,4.5,4.0,4.0,6
Ses03M_impro07_M011,[047.9100-050.9600]:,this will be like high school but even better,exc,5.0,5.0,1.5,6
Ses03M_impro07_F008,[050.6200-053.0600]:,yeah hopefully it won t be like high school,hap,4.0,3.0,3.0,4
Ses03M_impro07_F009,[053.8100-060.6400]:,oh man i am so proud of you that is how did you get i mean what did you do how did you find out or what,exc,4.0,4.0,4.0,6
Ses03M_impro07_M013,[066.6200-074.8200]:,i have some bad news i wa like what she s like not really you got into u s c and i wa like i wa like oh my god i wa about to tear my own hair out,exc,5.5,5.0,2.0,6
Ses03M_impro07_F010,[073.7000-075.2550]:,oh man,hap,3.5,3.0,2.5,4
Ses03M_impro07_M014,[074.8900-081.2600]:,yeah this is so crazy i mean i didn t get into any other school but i got into the school i wanted,hap,5.0,4.5,2.0,4
Ses03M_impro07_F011,[081.0000-085.0700]:,did you say yes yet i mean have you sent in your answer,hap,3.0,3.5,3.0,4
Ses03M_impro07_M015,[083.7000-087.6600]:,oh my god the first minute i got it i sent it back in,exc,5.0,4.5,2.0,6
Ses03M_impro07_F012,[086.7700-088.3700]:,all right,hap,3.5,3.5,2.5,4
Ses03M_impro07_M016,[087.8200-089.5900]:,so,exc,5.0,4.5,1.5,6
Ses03M_impro07_F013,[088.9900-097.0000]:,this is so great you know because i gone fit on downtown so i m going to be like right here i think i m going to be living at city light downtown,hap,4.0,3.0,3.0,4
Ses03M_impro07_M017,[095.4700-099.1500]:,this is so exciting this is like a new chapter in our life,exc,5.0,4.5,1.5,6
Ses03M_impro07_F014,[098.7800-101.5500]:,yeah it really is,hap,3.5,3.0,2.5,4
Ses03M_impro07_M018,[100.0200-107.6300]:,we re doing what we want to do then four year later we re going to be working professional making money sipping martini every day,exc,5.0,4.5,1.5,6
Ses03M_impro07_F016,[107.7400-111.6400]:,man i m just so happy for you i just,exc,4.0,3.0,3.0,6
Ses03M_impro07_M019,[111.1900-112.7800]:,thank you,exc,5.0,4.5,1.5,6
Ses03M_impro07_F017,[111.9100-116.2700]:,well i m happy for you but i m happy for me cause that mean you re going to stay,hap,4.0,4.0,3.5,4
Ses03M_impro07_M020,[115.6500-121.0500]:,and tonight my parent want to take me out to sushi and they said i could bring you,exc,5.0,5.0,2.0,6
Ses03M_impro07_F018,[120.7100-124.1100]:,oh great i would love to go,exc,4.0,4.0,3.5,6
Ses03M_impro07_M022,[123.2600-127.0700]:,yeah and they said get whatever you want and,exc,5.0,5.0,2.0,6
Ses03M_impro07_F019,[125.5100-127.8500]:,mmmm some miso soup,hap,4.0,3.5,3.0,4
Ses03M_impro07_M023,[127.2800-132.4475]:,some miso soup you can get whatever you can get a vat full of miso soup god,exc,5.0,5.0,2.0,6
Ses03M_impro07_M024,[132.8900-135.3800]:,this is going to be so great i have so many great idea,exc,5.0,5.0,2.0,6
Ses03M_impro07_M025,[140.9100-149.5600]:,it took them oh man it took them like i mean what it s like april now and any letter that come in april are usually the rejection letter so i wa just like,hap,4.5,5.0,1.5,4
Ses03M_impro07_F023,[150.9700-154.2600]:,oh my god i am so proud of you,neu,4.5,4.5,1.5,0
Ses03M_impro08a_M000,[006.5663-011.4367]:,hello this is viacom service how can i help you,neu,3.0,3.0,2.5,0
Ses03M_impro08a_F000,[010.7663-018.3382]:,hello god finally somebody look this is ridiculous i ve been waiting online for like a half an hour now,fru,1.5,4.0,4.5,1
Ses03M_impro08a_M001,[017.6481-020.8228]:,i m sorry ma am what can i help you with,neu,3.0,2.0,3.0,0
Ses03M_impro08a_F001,[019.8763-026.9925]:,look my my phone isn t working i don t understand what s going on i am trying to call out i m not receiving any call,fru,2.0,3.5,4.0,1
Ses03M_impro08a_F002,[027.0735-031.6225]:,and i need assistance with my not only is my work phone it s my home phone and look,fru,2.0,4.5,4.0,1
Ses03M_impro08a_F003,[031.7275-036.8342]:,this is my business this is how i make money is through my phone it need to be working can you please help me,fru,1.0,4.5,4.0,1
Ses03M_impro08a_M002,[034.1722-042.0202]:,okay can you give me the last four digit of your social security number so i can verify who i m speaking with,neu,3.0,2.5,3.5,0
Ses03M_impro08a_F004,[041.3695-044.4061]:,two two six six,neu,2.5,2.0,2.0,0
Ses03M_impro08a_M003,[043.4794-046.8315]:,okay and your name is,neu,3.0,2.5,3.0,0
Ses03M_impro08a_F005,[045.9836-048.5076]:,olivia,fru,3.5,3.0,2.5,1
Ses03M_impro08a_M004,[047.7977-053.2597]:,olivia um okay so how long ha this problem been,neu,3.0,3.5,3.5,0
Ses03M_impro08a_F006,[052.5302-061.8176]:,this ha been going on for the past two week i called every single day nobody is helping me you guy tell me the same thing over and over call again call again call again,fru,1.0,4.5,4.5,1
Ses03M_impro08a_M005,[060.1218-062.9021]:,so what exactly is the problem,neu,2.5,2.5,3.0,0
Ses03M_impro08a_F007,[061.8767-069.4487]:,i don t i don t know what the problem is that s what i want you guy to why is my service not turned on and i paid my bill on time i don t understand,fru,1.0,4.5,5.0,1
Ses03M_impro08a_M006,[068.6402-077.5530]:,um i think part of it ha to do with the network being down it s been having some trouble the last few week,neu,2.5,2.5,3.5,0
Ses03M_impro08a_F008,[074.8318-081.1900]:,okay well that is that is fine and all i don t care i really don t care because i want my phone to work that s all,fru,2.0,4.0,4.5,1
Ses03M_impro08a_F009,[081.2225-092.2433]:,that is i am paying you guy for service and i m not getting any service i get i get just dropped call all the time and now it s completely not working at all i can t even call out nine one one probably wouldn t even work,fru,1.5,5.0,5.0,1
Ses03M_impro08a_M007,[087.7474-090.4292]:,i understand we re not,neu,3.0,2.5,3.0,0
Ses03M_impro08a_M008,[091.0602-095.6349]:,no okay we re not charging you for any of these month we re going to give you three month free,neu,3.0,2.0,3.0,0
Ses03M_impro08a_F010,[094.6884-099.7560]:,well you better you better give me a whole freaking new phone that s what you better do,fru,1.5,3.5,4.5,1
Ses03M_impro08a_M009,[098.8687-101.6293]:,we can give you a new phone,neu,3.5,3.0,2.5,0
Ses03M_impro08a_F011,[099.9335-102.3589]:,i want a camera phone actually,fru,2.0,4.0,4.5,1
Ses03M_impro08a_M010,[101.7279-107.3871]:,we can do that we can do that you just have to sign a one year contract though with the,neu,3.0,3.5,3.5,0
Ses03M_impro08a_F012,[105.5533-110.1575]:,no no no i m done with these contract business because this is what can happen,fru,2.0,4.0,4.5,1
Ses03M_impro08a_F013,[110.2000-117.8182]:,you sign the contract and then down the line the phone doesn t work and you re stuck you can t go to a new no no contract for me you give me a new phone,ang,1.5,4.0,4.5,2
Ses03M_impro08a_M011,[116.2210-122.3732]:,besides it s sort of out of hand at the moment the whole electrical power outage,fru,2.0,3.5,3.0,1
Ses03M_impro08a_F014,[118.4295-121.2295]:,i want to talk to a supervisor,ang,2.0,3.5,4.0,2
Ses03M_impro08a_F015,[121.3084-126.2775]:,i would like to talk to your supervisor obviously you re incompetent and don t understand what i m asking,ang,1.5,3.0,5.0,2
Ses03M_impro08a_M012,[125.5676-133.9480]:,um let me connect you to my supervisor actually he s out right now so i m supervisor until he come back um,neu,3.0,4.0,4.0,0
Ses03M_impro08a_F016,[132.0353-134.4212]:,what,fru,1.5,3.5,3.5,1
Ses03M_impro08a_M013,[134.2043-140.4156]:,so you could speak with me some more you could call back later on maybe,neu,3.0,3.0,4.0,0
Ses03M_impro08a_F017,[134.4804-137.0635]:,that s ridiculous you know,fru,2.0,3.0,4.0,1
Ses03M_impro08a_F018,[138.8579-146.9819]:,no i don t want to call back you put me on hold for like hour and hour and it s money money money money and out of my pocket out of my pocket,fru,1.0,4.5,5.0,1
Ses03M_impro08a_M014,[141.8945-144.4579]:,i didn t put you on hold,fru,2.5,3.0,3.0,1
Ses03M_impro08a_M015,[144.5565-150.0974]:,there are a lot of people calling u having problem every phone company is having the same problem ma am,fru,2.0,3.0,4.0,1
Ses03M_impro08a_F019,[149.4664-152.4439]:,every phone every single phone company,fru,1.5,3.5,4.5,1
Ses03M_impro08a_M016,[151.3989-157.4327]:,mmm hmmm mmm hmmm the power outage everything hurricane katrina everything s really messed up,neu,2.0,3.0,3.5,0
Ses03M_impro08a_F020,[154.2778-158.6553]:,this is ridiculous well what are we supposed to do we starve then because i can t use my phone cause,ang,2.0,3.5,4.5,2
Ses03M_impro08a_F021,[158.6750-166.4244]:,i am a realtor and this is my business people are calling me all the time but you know and i don t have a land line i can t afford to have a land line,ang,1.5,4.5,4.5,2
Ses03M_impro08a_M017,[162.1454-164.3145]:,don t you,neu,3.0,2.0,2.5,0
Ses03M_impro08a_M018,[165.8131-170.0329]:,i m really sorry ma am there s not a lot we can do for it,neu,2.5,2.5,3.0,0
Ses03M_impro08a_F022,[167.5680-169.7174]:,that you better be sorry,ang,2.0,3.0,4.0,2
Ses03M_impro08a_F023,[169.7568-173.6019]:,well you re not helping me at all god this is so frustrating,fru,1.5,3.5,4.5,1
Ses03M_impro08a_M019,[171.3737-181.1935]:,what i can do for you if you want to make a call right now i could contact you through our computer i can call through my phone and you can speak through me,neu,3.0,3.0,3.5,0
Ses03M_impro08a_F024,[180.0104-183.8753]:,what no that s way too complicated look,fru,1.5,3.0,3.5,1
Ses03M_impro08a_F025,[183.8875-188.0359]:,you need to fix my phone i don t care what you have to do,fru,1.5,4.0,4.5,1
Ses03M_impro08a_M020,[185.9851-190.8753]:,i m sorry it ha to do with an electrical power outage and stuff,neu,2.0,3.0,3.5,0
Ses03M_impro08a_M021,[196.2388-203.5544]:,well okay i m going to give you a free phone card that you can use at any payphone and that s on u okay,neu,3.0,3.0,4.0,0
Ses03M_impro08a_F027,[201.0304-207.7347]:,yeah yeah woman going out in south central on the payphone at night oh that s real safe,fru,2.0,4.0,4.0,1
Ses03M_impro08a_M022,[206.9065-211.1854]:,i m i m sorry you chose to live there um,neu,2.5,2.0,3.0,0
Ses03M_impro08a_F028,[209.8840-215.3575]:,no no no i didn t choose to live here i work there okay yeah work work work,fru,1.5,3.5,4.5,1
Ses03M_impro08a_M023,[214.8728-218.8559]:,well i m sure maybe there s a phone at work you could use,neu,2.5,3.0,3.5,0
Ses03M_impro08a_F029,[218.1658-225.7180]:,we can t call out we can t make out line i don t work i work at another office,fru,2.5,4.0,4.0,1
Ses03M_impro08a_F030,[225.7771-229.8392]:,a law firm thank you very much,fru,3.0,2.5,3.0,1
Ses03M_impro08a_M024,[227.9067-231.1406]:,all right um,neu,3.0,3.5,2.5,0
Ses03M_impro08a_F031,[230.4899-239.5801]:,i work out of my home a a realtor and because i don t have a land line i need a phone and because of now i don t have one i don t know what to do and you re not helping me at all,fru,2.0,5.0,4.5,1
Ses03M_impro08a_F032,[239.6393-242.9323]:,in fact give me your name sir what s your name again,fru,2.0,3.5,4.5,1
Ses03M_impro08a_M025,[242.3999-246.0675]:,my name is sara,neu,3.0,3.5,3.0,0
Ses03M_impro08a_F033,[245.3971-248.9070]:,okay sara what,fru,2.5,2.5,3.5,1
Ses03M_impro08a_M026,[247.9999-250.6619]:,sara brown,neu,3.0,2.0,3.0,0
Ses03M_impro08a_F034,[249.7746-262.7494]:,sara brown sara brown um yeah i m going to get off the phone with you and then i m going to call back and i m going to give your supervisor your name because you re obviously incompetent to work here,fru,1.5,4.0,4.5,1
Ses03M_impro08a_M027,[261.2113-268.4283]:,you know maam we record this conversation so anything you say can be proven in a law of court so keep that in mind,neu,2.5,2.5,4.0,0
Ses03M_impro08a_F035,[266.4367-274.7974]:,what are you what are you a police officer now you know like i m done i m over it goodbye and i hope that you lose your job,fru,1.5,4.0,4.5,1
Ses03M_impro08b_M000,[015.1200-017.5200]:,hello,neu,3.0,3.0,3.0,0
Ses03M_impro08b_F001,[017.5400-025.3200]:,oh god i finally got you know how long i ve been waiting on line you put on hold for like five hour geez,fru,1.5,4.0,4.5,1
