Session_ID,Time_Record,Transcription,Sentiment,Valence,Activation,Dominance,discrete
Ses04M_script02_1_F018,[218.7400-228.8935]:,last year you will also remember our shoe got wet i got sand in my panty we got into a big fight over nothing you got a sore throat and we did not see the grunions,ang,2.5,3.5,3.5,2
Ses04M_script02_1_F019,[230.9900-233.9600]:,we didn t see them the first time either,fru,2.0,3.0,3.0,1
Ses04M_script02_1_M028,[244.3200-258.6359]:,no it s just seaweed isn t it oh man this is great i wouldn t miss this for anything i mean think about this i know you re not interested but just think about this for a minute,exc,3.5,3.0,2.5,6
Ses04M_script02_1_M029,[258.7307-271.7548]:,out there someplace is this huge mass of silver fish heading this way they don t know why we don t know why it wasn t a decision they didn t take a vote no one sent them an invitation or a map,exc,3.0,3.0,2.5,6
Ses04M_script02_1_M030,[271.7969-281.7952]:,just some little instinctual time release firecracker went off in their little body and all a one they turned and formed a line a long a the california coast and started swimming,exc,3.0,3.0,2.5,6
Ses04M_script02_1_M031,[281.8500-291.4900]:,they re swimming right now a if that s the only thing that matter it s single mindedness with no mind urgency that s pure urge,exc,3.5,3.5,2.5,6
Ses04M_script02_1_M032,[291.5700-309.6906]:,they don t know what drive them they don t give it a name or ask a question they just turn a one and start the swim that brings them here to this place where we stand for a massive celebration of sex and death oh man i m giving myself goose bump all my hair are popping up,exc,3.5,4.0,2.5,6
Ses04M_script02_1_F020,[309.3591-311.8692]:,that s the wind,fru,2.5,2.5,2.5,1
Ses04M_script02_1_M033,[311.3956-314.0951]:,well so what did you think,exc,3.0,2.5,1.5,6
Ses04M_script02_1_F021,[313.7000-315.4500]:,about what,fru,2.0,3.0,2.5,1
Ses04M_script02_2_F000,[005.9327-009.3542]:,look at this goose bump,neu,3.0,1.5,2.5,0
Ses04M_script02_2_M000,[008.9929-011.2696]:,well so what d you think,neu,3.0,3.5,3.0,0
Ses04M_script02_2_M001,[012.3600-014.2500]:,what i said,neu,3.0,3.0,3.0,0
Ses04M_script02_2_M002,[015.2000-019.0900]:,certainly is not it s slightly exaggerated scientific fact,fru,2.5,2.5,3.5,1
Ses04M_script02_2_M005,[045.1230-052.1400]:,carla can i ask you something don t take this the wrong way but are you having your period,fru,2.5,2.5,3.5,1
Ses04M_script02_2_F006,[051.7000-058.1800]:,goddamn it augie don t ask me that i hate it when you ask me that you always ask me that it s insulting,ang,1.5,4.5,4.5,2
Ses04M_script02_2_M006,[057.5300-059.2600]:,well what s bugging you,ang,2.0,3.0,3.5,2
Ses04M_script02_2_F007,[058.7600-063.1633]:,we just have different idea about what this evening is supposed to look like,ang,1.5,3.0,4.5,2
Ses04M_script02_2_M007,[062.6100-072.2600]:,there s nothing to it we come down here the grunions arrive they do their little fish business we go ooh ah look at the fish they go home we go home,ang,2.5,3.0,4.5,2
Ses04M_script02_2_F009,[075.2900-078.7091]:,we never do do we have we ever,ang,1.5,3.5,4.5,2
Ses04M_script02_2_F010,[083.6400-087.2900]:,twice is every time we ve tried that s ever,fru,1.5,4.0,4.5,1
Ses04M_script02_2_M011,[086.6900-088.7200]:,we ll see them this year,fru,2.0,3.5,3.5,1
Ses04M_script02_2_F012,[104.1200-106.4300]:,you don t have any idea what i m saying,fru,2.0,3.0,4.0,1
Ses04M_script02_2_M013,[105.8000-107.4600]:,no of course not,fru,1.5,2.5,3.5,1
Ses04M_script02_2_F013,[107.0200-114.8100]:,i did want to see it i always do i keep thinking this time will be the time but it never is,ang,1.5,4.0,4.5,2
Ses04M_script02_2_M014,[113.9700-117.9500]:,it s just fish nothing to get traumatized over,fru,2.5,2.5,3.0,1
Ses04M_script02_2_M015,[119.1700-124.5500]:,i ve been trying to work this backwards but i can t seem to pinpoint the moment when we took a turn for the worse,fru,2.0,3.5,4.0,1
Ses04M_script02_2_M016,[124.6300-137.2200]:,you were fine during the phone call from marge dinner wa okay doing the dish wa no problem let s see i took a shower uh you watched the news you said the grunions are running tonight i said great let s go i feel lucky tonight,fru,2.0,4.0,4.0,1
Ses04M_script02_2_M017,[137.2423-141.2000]:,uh okay so i m putting on my jacket putting out the animal,fru,2.5,3.0,3.5,1
Ses04M_script02_2_M018,[141.2000-144.8084]:,uh taking the car out of the gara out of the garage,fru,2.5,3.0,3.5,1
Ses04M_script02_2_M019,[145.4700-147.1286]:,uh,fru,3.0,2.0,2.5,1
Ses04M_script02_2_F016,[146.8614-161.1154]:,it wa about four year ago right after we got married we thought i wa pregnant and we had a bottle of champagne but no glass you asked me to dance so we took off our shoe and you popped the cork,sad,4.0,3.5,3.5,3
Ses04M_script02_2_M020,[178.4430-180.8000]:,wait a minute i ve got it,neu,3.0,3.0,3.5,0
Ses04M_script02_2_F018,[179.8200-184.0200]:,dancing barefoot in the sand drinking champagne from the bottle,sad,4.0,3.0,3.0,3
Ses04M_script02_2_M021,[183.1800-196.1800]:,it wa in the car right driving past the knickerbocker liquor locker you said let s get some champagne and i said time a wasting or something like that right that s it right you want this to be like the other time that s it of course,neu,2.5,3.0,4.0,0
Ses04M_script02_2_F019,[195.6200-200.9500]:,i d rather not remember some thing i d rather not hope for some thing,sad,2.0,2.5,3.5,3
Ses04M_script02_2_F020,[206.0600-208.2600]:,no,sad,2.0,2.0,2.5,3
Ses04M_script02_2_F021,[210.0500-212.3855]:,no,sad,2.0,2.0,3.0,3
Ses04M_script02_2_M024,[212.3800-215.3100]:,what you want me to breathe in your ear,fru,2.5,2.5,3.0,1
Ses04M_script02_2_F022,[214.9800-216.5281]:,no,fru,2.0,2.5,3.5,1
Ses04M_script02_2_M025,[215.8200-218.0600]:,you want to get married again,fru,2.5,3.5,3.0,1
Ses04M_script02_2_F023,[217.4000-218.6300]:,no,fru,2.0,3.0,3.5,1
Ses04M_script02_2_M026,[218.2300-220.0300]:,what you want a divorce,fru,2.0,3.5,4.0,1
Ses04M_script02_2_F024,[219.3400-220.7152]:,no,fru,1.0,3.5,4.0,1
Ses04M_script02_2_M027,[220.3500-221.8700]:,a vacation,fru,2.0,3.5,3.5,1
Ses04M_script02_2_F025,[221.4700-222.8600]:,no,ang,2.0,3.5,4.5,2
Ses04M_script02_2_F026,[230.0100-233.0800]:,i want something to turn out the way it s supposed to,ang,1.5,3.5,4.0,2
Ses04M_script02_2_M029,[232.1900-243.7403]:,well welcome to the human race you think this is what i had in mind you think that when i proposed i had this great fantasy going that four year down the line we d come to the beach and yell at each other over fish no,ang,1.5,4.0,4.5,2
Ses04M_script02_2_M031,[252.4100-260.3500]:,and we ll have three fat rosy kid and ha ha ha baby the joke s on u cause you know what you get carla you know what you get this,ang,1.5,4.5,4.5,2
Ses04M_script02_2_F027,[259.9600-263.4200]:,this what what is this this isn t even anything,ang,1.5,4.0,4.5,2
Ses04M_script02_2_M032,[262.6200-264.2600]:,yes it is,fru,2.5,3.0,4.0,1
Ses04M_script02_2_F028,[263.4500-267.8200]:,oh right sure this is standing on the beach this is waiting this is fighting,ang,1.5,4.5,4.5,2
Ses04M_script02_2_M033,[267.3100-268.5800]:,right,fru,2.5,2.5,4.0,1
Ses04M_script02_2_F029,[268.0800-271.7300]:,but this isn t anything like i thought anything would be like,ang,1.5,3.5,4.5,2
Ses04M_script02_2_M034,[271.0000-272.9500]:,no i know me neither,ang,2.5,3.5,3.5,2
Ses04M_script02_2_M035,[281.4400-283.7200]:,i m doing the best i can,fru,2.0,3.0,4.0,1
Ses04M_script02_2_F031,[283.2800-296.7700]:,i know you are augie really i do i know you meant for this to be special and nice and it s the full moon and the sand and everything but i just couldn t help thinking about being somewhere else,fru,2.0,3.5,4.5,1
Ses04M_script02_2_F032,[298.7400-300.4934]:,i didn t say that,sad,2.0,2.5,4.0,3
Ses04M_script02_2_M037,[300.1816-304.1460]:,no i know but still i know i don t make you happy,sad,2.0,3.0,3.0,3
Ses04M_script02_2_M038,[308.3331-310.3000]:,yeah,sur,3.0,3.0,2.0,5
Ses04M_script02_2_M039,[320.0036-324.8300]:,actually now that you mention it no i don t,hap,2.5,3.0,3.5,4
Ses04M_script02_2_F035,[324.2900-329.9900]:,okay fine so we re in the wrong spot but we re with the right person,hap,3.5,2.5,3.5,4
Ses04M_script02_2_M040,[329.5100-336.3000]:,i don t know it seemed like a good spot to me i mean look at the view you ve got of the moon from here,hap,2.5,3.0,3.5,4
Ses04M_script02_2_F036,[335.7722-346.1000]:,yeah i noticed that look pretty on the water doesn t it big ol white moon i m sorry augie,hap,4.0,3.0,4.0,4
Ses04M_script02_2_M041,[346.6600-353.3225]:,shh if we re very quiet the fish might come,hap,4.0,3.0,3.5,4
Ses04M_script03_1_M000,[007.4200-009.3200]:,good god,fea,2.5,4.0,4.0,7
Ses04M_script03_1_M001,[009.8600-010.9100]:,i wonder,fea,3.0,3.5,4.0,7
Ses04M_script03_1_F001,[010.5800-013.5400]:,nobody know we re here except freda and she wouldn t ring up,fea,2.0,4.0,4.0,7
Ses04M_script03_1_M002,[013.1500-014.6900]:,it must be them then,fea,2.5,3.5,4.0,7
Ses04M_script03_1_F002,[014.2900-016.2800]:,what are we to do,fea,2.0,4.0,4.0,7
Ses04M_script03_1_M003,[015.7076-019.1500]:,we ll be alright darling whatever happens aren t we,neu,3.5,3.0,3.5,0
Ses04M_script03_1_M004,[020.7000-022.8700]:,i don t care then,exc,3.0,3.0,3.5,6
Ses04M_script03_1_F005,[028.5700-031.8200]:,oh it sent shiver up my spine,exc,4.0,4.5,4.5,6
Ses04M_script03_1_M006,[031.2700-034.0200]:,what shall we do if they suddenly walk in on u,exc,3.0,3.5,4.0,6
Ses04M_script03_1_F006,[033.5400-035.3900]:,behave exquisitely,exc,4.0,3.5,3.5,6
Ses04M_script03_1_M007,[034.9700-037.4500]:,with the mo with the most perfect poise,exc,3.0,3.5,3.5,6
Ses04M_script03_1_F007,[037.1200-040.0400]:,certainly i shall probably do a court curtsey,exc,5.0,4.0,3.5,6
Ses04M_script03_1_F008,[043.7500-047.0000]:,but what s so horrible is that one can t stay happy,exc,3.0,3.5,3.5,6
Ses04M_script03_1_F009,[047.9500-050.9500]:,it s true the whole business is a very poor joke,exc,2.5,3.5,4.0,6
Ses04M_script03_1_M010,[050.4300-054.1000]:,meaning that sacred and beautiful thing love,neu,3.0,3.0,3.5,0
Ses04M_script03_1_M012,[066.5500-069.8300]:,you mustn t be serious my dear that s just what they want,neu,2.5,3.0,3.5,0
Ses04M_script03_1_F012,[069.4200-070.7400]:,who s they,exc,4.0,3.0,2.5,6
Ses04M_script03_1_M013,[070.2600-084.4500]:,all the futile moralist who try to make life unbearable laugh at them be flippant laugh at everything all their sacred shibboleth flippancy brings out the acid acid in their damn sweetness and light,ang,2.5,4.0,4.5,2
Ses04M_script03_1_F013,[083.8900-087.4200]:,if i laugh at everything i must laugh at u too,neu,4.0,3.5,4.0,0
Ses04M_script03_1_F014,[090.2854-095.4400]:,how long will it last this ludicrous and overbearing love of ours,exc,4.0,4.0,4.0,6
Ses04M_script03_1_F015,[096.9400-100.1596]:,shall we always want to bicker and fight,exc,2.5,3.5,3.0,6
Ses04M_script03_1_M016,[099.5976-103.1100]:,no that fire will fade along with our passion,sad,2.0,3.0,3.0,3
Ses04M_script03_1_F017,[107.4900-111.3400]:,what happens if one of u dy doe the one that s left still laugh,exc,3.0,4.0,4.0,6
Ses04M_script03_1_F018,[113.0000-115.2800]:,well that s serious enough isn t it,exc,2.5,3.5,3.0,6
Ses04M_script03_1_M021,[139.1744-147.1219]:,let s savor the delight of the moment come and kiss me darling before your body rot and worm pop in and out of your eye socket,exc,3.5,3.5,4.5,6
Ses04M_script03_1_F021,[162.9098-171.5798]:,thank you dear the same applies to you except that if i catch you so much a looking at another woman i will kill you,exc,4.0,4.0,4.5,6
Ses04M_script03_1_F022,[173.6400-175.6100]:,which particular one,exc,4.0,3.5,3.0,6
Ses04M_script03_1_F023,[178.7000-183.8000]:,oh charles that wa his name charles oh he did wriggle so beautifully,exc,5.0,4.5,4.0,6
Ses04M_script03_1_M025,[183.3000-185.2100]:,horrible thing i hated it,ang,2.0,3.5,4.5,2
Ses04M_script03_1_F024,[184.5400-190.1500]:,i know you did you threw it out of the window into the grand canal i don t think i ll ever forgive you for that,exc,3.0,4.0,4.0,6
Ses04M_script03_1_F025,[191.0600-193.6000]:,it went on intermittently for day,exc,4.0,3.5,3.0,6
Ses04M_script03_1_F026,[197.5300-201.5200]:,it burnt my comb too and all the towel in the bathroom,exc,4.0,4.0,3.5,6
Ses04M_script03_1_M028,[201.3627-203.3400]:,line,neu,2.5,1.5,2.0,0
Ses04M_script03_1_M029,[203.4000-205.5000]:,how that wa a rouser wasn t it,exc,3.0,3.5,3.5,6
Ses04M_script03_1_F027,[204.9900-207.7500]:,that wa the first time you ever hit me,exc,3.5,3.5,3.5,6
Ses04M_script03_1_F028,[208.6000-215.2300]:,the manager came in and found is rolling about on the floor biting and scratching like panther oh dear,exc,4.5,4.5,4.0,6
Ses04M_script03_1_F029,[218.3100-222.6500]:,how ridiculous how utterly utterly ridiculous,exc,4.5,4.5,4.5,6
Ses04M_script03_1_F030,[225.0800-227.4261]:,and very much sillier,exc,4.0,3.5,3.5,6
Ses04M_script03_1_M033,[226.9000-231.7100]:,a a matter of fact the real cause of that row wa peter burden,neu,3.0,3.5,4.0,0
Ses04M_script03_2_F000,[012.1431-014.7400]:,that wa the first time you ever hit me,ang,2.5,3.5,3.0,2
Ses04M_script03_2_M001,[014.1200-016.1700]:,i didn t hit you very hard,neu,3.0,2.5,2.0,0
Ses04M_script03_2_F001,[015.7500-022.0670]:,the manager came in and found u rolling about on the floor biting and scratching like panther oh dear,hap,4.5,3.0,2.5,4
Ses04M_script03_2_F002,[023.3800-027.2300]:,how ridiculous how utterly utterly ridiculous,hap,4.5,3.5,2.5,4
Ses04M_script03_2_F003,[027.6500-029.8900]:,and very much sillier,hap,4.0,3.0,2.5,4
Ses04M_script03_2_M004,[029.3700-032.6400]:,a a matter of fact the real cause of that row wa peter burden,fru,3.0,3.0,2.5,1
Ses04M_script03_2_M005,[033.8200-036.9700]:,i knew nothing of the sort you took present from him,fru,2.5,3.5,3.0,1
Ses04M_script03_2_F006,[042.2600-046.6700]:,not at all it wa very pretty i still have it and i wear it often,exc,4.0,3.5,3.0,6
Ses04M_script03_2_M007,[046.0700-049.2300]:,you went out of your way to torture me over peter burden,fru,2.0,3.5,3.0,1
Ses04M_script03_2_M008,[051.9000-055.1700]:,you must admit that he wa in love with you wasn t he,ang,2.0,3.0,2.5,2
Ses04M_script03_2_F008,[054.7400-058.5600]:,just a little perhaps nothing serious,hap,4.0,2.5,2.5,4
Ses04M_script03_2_M009,[060.0200-061.2951]:,line,neu,2.5,1.5,0.5,0
Ses04M_script03_2_F009,[061.0100-062.0400]:,let him kiss you,neu,3.0,3.0,2.0,0
Ses04M_script03_2_M010,[061.7300-063.8900]:,you let him kiss you you said you did,ang,2.0,4.0,3.0,2
Ses04M_script03_2_F010,[063.3200-065.0737]:,what of it,ang,2.5,3.0,3.0,2
Ses04M_script03_2_M011,[064.3898-066.4700]:,what of it,ang,2.0,4.5,3.0,2
Ses04M_script03_2_M012,[069.5800-071.4100]:,what about me,ang,2.0,4.5,2.5,2
Ses04M_script03_2_F012,[070.8900-074.8193]:,if you hadn t been so nosey you never would have known a thing about it,fru,4.0,3.0,3.5,1
Ses04M_script03_2_M013,[074.3577-077.1000]:,that s a nice point of view i must say,ang,2.0,3.0,2.5,2
Ses04M_script03_2_F013,[075.9200-078.7400]:,oh dear i m bored with this conversation,fru,2.0,3.5,2.5,1
Ses04M_script03_2_M014,[077.7500-080.5642]:,so am i bored stiff,ang,2.5,3.5,2.5,2
Ses04M_script03_2_F014,[082.0300-083.9324]:,no thanks,ang,2.5,3.5,2.5,2
Ses04M_script03_2_M016,[083.4879-086.1900]:,i ll have a little myself i think,fru,3.0,2.0,2.5,1
Ses04M_script03_2_F015,[085.6900-090.0800]:,i don t see why you want it you ve already had two glass,fru,2.0,3.0,3.5,1
Ses04M_script03_2_M017,[089.8400-093.8900]:,no particular reason anyhow they were very small one,fru,3.0,3.0,2.5,1
Ses04M_script03_2_F016,[093.4600-098.2300]:,it seems so silly to go on and on and on with such a thing,fru,2.0,3.5,3.0,1
Ses04M_script03_2_M018,[097.6600-104.6000]:,you can hardly call three liquor glass in a whole evening going on and on and on,fru,2.5,2.5,3.0,1
Ses04M_script03_2_F017,[104.0500-107.0655]:,it s become a habit with you,ang,2.5,2.5,2.5,2
Ses04M_script03_2_M019,[106.2600-111.3400]:,you needn t be so grand just because you don t happen to want any at the moment,fru,2.0,3.5,2.5,1
Ses04M_script03_2_F018,[110.5500-112.4300]:,oh don t be so stupid,fru,1.5,3.5,3.0,1
Ses04M_script03_2_M020,[112.0200-113.6200]:,really amanda,ang,2.0,3.5,3.0,2
Ses04M_script03_2_F019,[112.8600-114.4688]:,what,ang,1.5,4.0,3.5,2
Ses04M_script03_2_M021,[113.9046-116.1400]:,nothing,ang,2.5,4.0,3.0,2
Ses04M_script03_2_M022,[117.8100-120.4200]:,going out somewhere my dear,ang,2.5,3.0,2.5,2
Ses04M_script03_2_F020,[119.9800-123.1400]:,no just making myself fascinating for you,fru,2.5,3.5,3.0,1
Ses04M_script03_2_M023,[122.2600-126.0800]:,oh that reply ha broken my heart,fru,2.5,2.5,2.0,1
Ses04M_script03_2_M024,[129.8400-132.5500]:,a a matter of fact that s perfectly true,ang,2.5,3.5,2.5,2
Ses04M_script03_2_F022,[131.5700-133.2200]:,oh no it isn t,ang,2.0,4.0,3.0,2
Ses04M_script03_2_M025,[132.5900-133.9300]:,yes it is,ang,3.5,3.0,3.0,2
Ses04M_script03_2_F023,[133.3400-135.6700]:,oh be quiet,ang,2.0,3.5,3.0,2
Ses04M_script03_2_M026,[136.4393-138.0200]:,line,neu,2.5,2.0,1.5,0
Ses04M_script03_2_F024,[139.7800-141.2266]:,it s a pity you didn t it s a pity you didn t have more brandy,neu,2.5,2.0,2.0,0
Ses04M_script03_2_M027,[140.9300-145.0800]:,it s a pity you didn t have any more brandy it might have made you a little le disagreeable,ang,2.5,3.5,3.5,2
Ses04M_script03_2_F025,[144.5600-148.4800]:,it doesn t seem to have worked such wonder with you,fru,2.0,3.5,3.5,1
Ses04M_script03_2_M028,[149.6400-151.7900]:,line,neu,2.5,2.0,2.0,0
Ses04M_script03_2_M029,[151.8300-155.3600]:,snap oh snap snap snap like a little adder,ang,2.5,3.5,3.0,2
Ses04M_script03_2_F026,[154.8700-157.4400]:,adder don t snap they sting,ang,2.5,3.0,3.5,2
Ses04M_script03_2_M030,[157.0300-161.4300]:,they nonsense they have a little bag of venom behind their fang and they snap,ang,2.5,3.5,3.5,2
Ses04M_script03_2_F027,[160.7200-162.2000]:,they sting,fru,2.0,3.0,3.0,1
Ses04M_script03_2_M031,[161.4900-162.7500]:,they snap,ang,2.0,4.0,3.5,2
Ses04M_script03_2_F028,[162.2600-168.5300]:,i don t care do you understand i don t care i don t mind if they bark and roll about like hoop,ang,2.0,4.5,3.5,2
Ses04M_script03_2_F029,[171.2500-173.8490]:,yes i did quite a lot,ang,2.5,3.0,3.5,2
Ses04M_script03_2_M033,[173.4400-176.8300]:,i suppose you let him kiss you a good deal more then hmm,ang,2.0,2.5,3.5,2
Ses04M_script03_2_F030,[175.8400-178.6900]:,mind your own business,ang,2.0,3.0,3.5,2
Ses04M_script03_2_M034,[180.0400-184.2000]:,you must have had a riotous time,ang,2.5,3.0,3.0,2
Ses04M_script03_2_M035,[186.0500-191.6300]:,no restraint at all very enjoyable you never had much anyhow,ang,2.5,3.0,3.5,2
Ses04M_script03_2_F031,[191.1500-195.1600]:,you re quite insufferable i expected it s because you re drunk,ang,2.0,3.5,3.0,2
Ses04M_script03_2_M036,[194.7300-196.5300]:,i m not in the least drunk,ang,2.0,4.0,3.5,2
Ses04M_script03_2_F032,[196.0100-197.9500]:,you always had a weak head,ang,3.0,3.5,3.0,2
Ses04M_script03_2_M037,[197.3600-207.1039]:,i think i mentioned once before that i ve only had three minute liquor glass of brandy this whole evening that s hardly enough to get a child of two drunk,fru,2.5,3.5,3.0,1
Ses04M_script03_2_F033,[206.7100-212.1477]:,on the contrary a child of two could get violently drunk on only one glass of brandy,ang,2.0,4.0,3.5,2
Ses04M_script03_2_M038,[211.5664-217.0300]:,very interesting and how about a child of four and a child of six and a child of nine,ang,2.5,2.5,3.5,2
Ses04M_script03_2_F034,[216.7000-218.6600]:,oh shut up,ang,2.0,2.5,3.5,2
Ses04M_script03_2_F035,[224.9200-228.2900]:,not very funny dear you d better have some more brandy,ang,2.0,3.5,3.0,2
Ses04M_script03_2_M040,[227.3600-229.9600]:,very good idea i will,ang,2.5,3.5,3.5,2
Ses04M_script03_2_M041,[230.5277-233.2400]:,you better turn that off i think,ang,2.5,3.5,3.5,2
Ses04M_script03_2_F036,[232.7500-235.0415]:,why,ang,2.0,3.5,2.5,2
Ses04M_script03_2_F037,[238.1200-242.2000]:,there aren t any people upstairs it s a photographer s studio,ang,3.5,3.5,3.0,2
Ses04M_script03_2_M043,[241.6583-244.7400]:,there are people downstairs i suppose,ang,2.5,2.5,3.0,2
Ses04M_script03_2_F039,[249.3600-252.1562]:,turn it on again please,ang,2.0,3.5,3.5,2
Ses04M_script03_2_F040,[253.2700-257.2500]:,very well if you insist on being boorish and idiotic,ang,2.5,3.5,3.5,2
Ses04M_script03_2_M046,[256.9100-259.1100]:,turn it off it s driving me mad,ang,1.5,4.0,3.5,2
Ses04M_script03_2_F041,[258.7100-261.9019]:,go away go away i hate you,ang,1.5,4.0,3.5,2
Ses04M_script03_2_M047,[261.3000-263.5400]:,turn it off,ang,2.0,4.5,4.0,2
Ses04M_script03_2_F042,[263.2500-268.4503]:,you are far too temperamental try to control yourself,ang,2.0,4.0,3.0,2
Ses04M_script03_2_F043,[269.1200-270.9465]:,we swapped listen,neu,2.0,2.0,1.5,0
Ses04M_script03_2_M048,[270.8098-272.0237]:,listen,ang,2.5,3.5,3.0,2
Ses04M_script03_2_F044,[271.8356-276.5700]:,listen indeed i am sick and tired of listening to you you damn sadistic bully,ang,1.5,4.0,3.5,2
Ses04M_script03_2_M049,[276.1400-278.8000]:,you re a vile tempered loosed living,ang,1.5,3.0,3.0,2
Ses04M_script03_2_F045,[278.3300-279.0900]:,stop,ang,2.0,4.5,2.5,2
Ses04M_script03_2_M050,[278.8400-284.0400]:,wicked little beast and i i hope i never see you again a long a live,ang,1.5,4.5,4.0,2
Ses04M_script03_2_F046,[279.1200-284.3000]:,stop i hate you do you hear me you re conceited and overbearing and utterly impossible,ang,1.5,4.0,3.0,2
Ses04M_script03_2_F047,[284.3300-288.1800]:,this is the end do you understand the end finally and forever,ang,2.0,3.5,3.5,2
Ses04M_script03_2_M051,[287.3800-289.1600]:,you re not going like this,ang,2.0,3.5,4.0,2
Ses04M_script03_2_F048,[288.3800-289.7500]:,oh yes i am,ang,2.0,4.0,3.5,2
Ses04M_script03_2_M052,[289.2700-290.3500]:,no you re not,ang,2.5,4.5,4.0,2
Ses04M_script03_2_F049,[289.7700-295.2100]:,let go of me you re a cruel fiend and i hate and loath you thank god i discovered in time what you re really like,ang,1.5,4.5,4.0,2
Ses04M_script03_2_M053,[291.1500-293.0500]:,shut up shut up,ang,1.5,4.0,4.0,2
Ses04M_script03_2_M054,[293.0800-295.4300]:,you re a mean evil minded,ang,1.5,4.0,4.0,2
Ses04M_script03_2_F050,[295.2200-296.7200]:,marry you again huh,ang,1.5,5.0,3.0,2
Ses04M_script03_2_M055,[295.6698-300.3600]:,little vampire and i hope to god i never set eye on you a long a i live,ang,1.5,4.0,4.0,2
Ses04M_script03_2_F051,[296.7300-300.7900]:,never never never i d rather die in torment beast brute,ang,1.5,4.5,4.0,2
Ses04M_script03_2_M056,[300.3900-302.3100]:,whore,ang,1.5,4.5,4.5,2
Ses04M_script03_2_F052,[300.8200-302.3500]:,swine,ang,1.5,4.5,3.5,2
Ses05F_impro01_F000,[003.6132-006.1700]:,hi i need an id,neu,4.0,2.5,3.0,0
Ses05F_impro01_M000,[005.7800-014.7800]:,ahh yeah this is the wrong line i m sorry you need to go back over to line two b that s where you should have started from,neu,2.5,2.5,4.0,0
Ses05F_impro01_F001,[014.1500-019.4900]:,okay i m sorry but i just stood in this line for an hour can i is there any way i can,fru,2.5,3.0,3.0,1
Ses05F_impro01_F002,[022.8500-026.9000]:,no they told me i m sorry but they told me to be in this line,fru,2.5,3.0,3.5,1
Ses05F_impro01_F003,[029.9800-034.4600]:,what i mean what what s the difference what do i need to do there that i can t do here,fru,2.5,3.0,3.0,1
Ses05F_impro01_M003,[034.1100-040.8800]:,well i have no camera here i can t help you at all here ma am i have form for something completely different you need to go to a different place,neu,2.0,4.0,3.5,0
Ses05F_impro01_F004,[039.4800-042.1800]:,can you just can i just get the right,fru,2.5,3.5,3.0,1
Ses05F_impro01_M004,[041.1100-044.3900]:,simply step to line two a ma am i m sorry,fru,2.0,4.0,4.0,1
Ses05F_impro01_F005,[042.8400-045.7800]:,would you be able to put me at the front of that line,fru,2.5,3.5,3.0,1
Ses05F_impro01_M005,[044.4200-048.1600]:,there is a large line of people behind you waiting to be,fru,2.0,4.0,4.0,1
Ses05F_impro01_F006,[046.8200-053.7400]:,i know i ve been in line with these people i understand i understand what it s like could you please like call over and,fru,2.0,3.5,4.0,1
Ses05F_impro01_M006,[052.1100-059.0900]:,i don t want to be rude here ma am but line two b is where you need to be this is the line for registration,fru,2.0,3.5,4.5,1
Ses05F_impro01_F007,[058.2800-065.3300]:,i hear that i hear that thank you but i ve waited in line for so long and i don t want to have to be here all day,fru,2.0,3.5,4.0,1
Ses05F_impro01_M007,[067.6900-069.3400]:,i don t have those,fru,2.0,3.0,3.0,1
Ses05F_impro01_F008,[065.3400-069.5800]:,so could i maybe get the form from you fill it out here and maybe you could,neu,2.0,3.5,3.5,0
Ses05F_impro01_M008,[069.3700-074.3600]:,i don t have those form ma am i can t help you that s why you need to go to line two a,fru,2.0,4.0,4.0,1
Ses05F_impro01_F009,[074.0600-076.6800]:,and how long is that going to take,fru,1.5,3.0,3.5,1
Ses05F_impro01_M009,[076.1600-087.3000]:,ma am obviously i have no idea how long it s taking there seems to be a bit of a line there it look like thirty forty people it could take four to five hour i m sorry,fru,1.5,3.5,4.0,1
Ses05F_impro01_F010,[086.8900-088.5000]:,i don t,fru,1.5,3.5,3.5,1
Ses05F_impro01_M010,[087.6000-089.6000]:,there s nothing i can do for you ma am,fru,2.5,3.5,3.5,1
Ses05F_impro01_F011,[088.5200-091.5428]:,i don t have time for this today and,fru,2.0,3.0,3.5,1
Ses05F_impro01_M011,[091.3100-099.8800]:,but obviously i don t have time for you to stand here and waste my time in this line there are other people who need service behind you who are waiting for the right thing,fru,1.5,3.5,4.5,1
Ses05F_impro01_F012,[096.2500-101.6000]:,is there anything you can do please have some compassion is there something you can do,fru,2.0,3.5,4.0,1
Ses05F_impro01_M012,[100.5200-110.6000]:,i am a very compassionate person and i m offended that you imply that i m not of course i m compassionate look i work in the d m v what do you think i am go wait in line two a,fru,1.5,4.0,4.5,1
