Session_ID,Time_Record,Transcription,Sentiment,Valence,Activation,Dominance,discrete
Ses02F_script02_1_M043,[285.9500-287.8700]:,"Well, so what do you think?",neu,3.0,3.0,3.0,0
Ses02F_script02_1_F021,[287.6800-289.1700]:,About what?,neu,3.5,2.0,3.0,0
Ses02F_script02_1_M044,[288.8000-290.2900]:,What I was saying.,neu,3.0,3.0,3.0,0
Ses02F_script02_2_M000,[004.2700-006.3631]:,"Well, so what do you think?",exc,3.5,3.5,3.5,6
Ses02F_script02_2_F000,[006.3300-007.7200]:,About what?,neu,2.5,2.0,2.5,0
Ses02F_script02_2_M001,[007.7600-009.0700]:,What I was saying.,neu,3.0,3.5,3.0,0
Ses02F_script02_2_F001,[009.5015-011.2600]:,It's ridiculous.,fru,2.5,3.5,2.5,1
Ses02F_script02_2_M002,[011.4400-015.5300]:,It certainly is not.  It's slightly exaggerated scientific fact.,neu,2.5,3.5,4.0,0
Ses02F_script02_2_M003,[021.2400-023.6600]:,"Well, I'm not the only one.  Look at all these people.",neu,2.5,3.5,3.0,0
Ses02F_script02_2_M005,[038.7300-045.5600]:,"Carla, can I ask you something?  Don't take this wrong, but are you having your period?",neu,3.0,3.0,2.5,0
Ses02F_script02_2_F005,[045.2100-052.6500]:,"God damn it, Augie, don't ask me that.  I hate it when you ask me that.  You always ask me that.  It's insulting.",ang,1.5,4.5,4.5,2
Ses02F_script02_2_M006,[051.7900-053.5100]:,"Well, what's bugging you?",fru,2.5,3.5,4.0,1
Ses02F_script02_2_F006,[053.2000-057.7000]:,We just have different ideas of what this evening is supposed to look like.,ang,2.0,4.0,4.0,2
Ses02F_script02_2_M007,[057.5500-067.7200]:,"There's nothing to it.  We come here, the grunion arrive, they do their little fish business, we go ooh, ah, look at the fish.  They go home. We go home.",neu,2.5,4.0,4.0,0
Ses02F_script02_2_F007,[067.3100-070.9800]:,"For heaven sake, we're not going to see the grunions.",fru,1.5,4.0,3.5,1
Ses02F_script02_2_M008,[070.6700-072.0900]:,Why not?,fru,2.5,3.0,3.0,1
Ses02F_script02_2_F008,[071.7500-075.2300]:,"We never do, do we?  I mean, have we ever?",fru,2.0,4.0,3.5,1
Ses02F_script02_2_M009,[075.0400-077.4500]:,We've missed them twice.  That's not ever.,neu,2.0,3.0,3.0,0
Ses02F_script02_2_F009,[076.8900-079.7300]:,Twice is every time we've tried. That's ever.,fru,2.0,3.5,4.0,1
Ses02F_script02_2_M010,[079.4000-081.1300]:,"Well, we'll see them this year.",neu,2.5,3.5,3.5,0
Ses02F_script02_2_F010,[080.7700-086.1500]:,"No, we won't.  It's pointless.  It's like waiting up to see Santa Claus.",fru,2.0,4.0,4.5,1
Ses02F_script02_2_F011,[086.1600-099.7100]:,"I mean, I feel like my whole life is gonna be spent standing on the beach with my eyes wide open and my hands clasped expectantly waiting for the fish to show up.  And the fish won't show up.",ang,1.5,5.0,5.0,2
Ses02F_script02_2_M011,[099.6700-101.5000]:,I thought you wanted to see it.,fru,2.5,2.5,2.5,1
Ses02F_script02_2_F012,[101.2800-103.8100]:,You don't understand anything I'm saying.,fru,2.0,3.5,3.5,1
Ses02F_script02_2_M012,[103.5800-105.1700]:,"No, of course not.",fru,1.5,3.0,4.0,1
Ses02F_script02_2_F013,[104.9300-111.9000]:,I did want to see it.  I always do.  I keep thinking that this is gonna be the time and it never is.,fru,1.5,4.0,4.5,1
Ses02F_script02_2_M013,[111.4600-114.7500]:,It's just fish.  Nothing to get traumatized about.,neu,2.5,3.0,3.5,0
Ses02F_script02_2_M014,[115.9200-124.0800]:,"All right.  Look, I've been trying to work this backwards, but I cannot seem to figure out the exact moment that we took a turn for the worst.",fru,2.0,4.0,3.5,1
Ses02F_script02_2_M016,[134.1000-138.8100]:,"You said, ""Hey the grunion are running tonight.""  I said, ""Great, let's go.  I feel lucky.""",neu,3.0,4.0,4.0,0
Ses02F_script02_2_M017,[138.8600-144.9200]:,"Okay, so I'm putting on my jacket, putting out the animals, getting the car out of the garage--",neu,3.0,4.0,3.5,0
Ses02F_script02_2_F015,[143.6900-149.7200]:,"Do you remember the first time we came to see it?  It was about four years ago, right after we got married.",sad,2.5,3.0,4.0,3
Ses02F_script02_2_F016,[149.7400-159.7600]:,"I thought I was pregnant, you had a bottle of champagne, but no glasses.  You asked me to dance, so we kicked off our shoes and you popped the cork.",sad,4.0,4.0,3.5,3
Ses02F_script02_2_F017,[159.7833-169.3200]:,"And while we were dancing, you said the softest, most intimate things to me right into my ear so that I could feel them as much as hear them.",sad,3.5,4.0,4.5,3
Ses02F_script02_2_F018,[169.3400-178.1700]:,"And I remember thinking, this is it.  You know, at last--at last I am as happy as I am supposed to be.",sad,4.0,4.5,4.0,3
Ses02F_script02_2_M018,[177.5600-179.3800]:,Wait a minute.  I've got it.,neu,4.0,3.5,3.5,0
Ses02F_script02_2_F019,[178.7800-183.3300]:,"Just dancing barefoot in the sand, drinking champagne out of the bottle.",sad,4.0,4.0,4.0,3
Ses02F_script02_2_M019,[183.1800-192.2200]:,"It was in the car, right?  Driving past the Knickerbocker Liquor Locker, you said, ""let's get some champagne,"" and I said, ""time's a wasting"" or something like that, right?",neu,3.0,4.0,4.0,0
Ses02F_script02_2_M020,[192.2500-197.0700]:,"Yeah, of course, I see it now.  You want this to be like that other time, right?  That's it, right?",neu,3.0,4.0,4.0,0
Ses02F_script02_2_F020,[196.7300-202.0100]:,I'd rather not remember some things.  I would rather not hope for some things.,sad,2.5,3.0,3.5,3
Ses02F_script02_2_M021,[201.3200-206.7400]:,"Okay, yeah, sure, I see it now.  Listen, you wanna dance?",neu,3.0,3.5,3.5,0
Ses02F_script02_2_F021,[206.4100-207.5500]:,No.,sad,2.5,2.0,2.5,3
Ses02F_script02_2_M022,[207.5100-209.4900]:,You want me to go get some champagne?,neu,3.0,3.5,3.0,0
Ses02F_script02_2_F022,[208.7400-209.7200]:,No.,sad,2.5,2.5,2.0,3
Ses02F_script02_2_M023,[209.5700-211.3200]:,Take off our shoes?,neu,3.0,3.5,2.5,0
Ses02F_script02_2_M024,[211.3900-213.9400]:,"Well, what?  You want me to breathe in your ear?",fru,2.0,3.5,2.5,1
Ses02F_script02_2_F024,[213.2000-214.0700]:,No.,sad,2.0,2.0,2.5,3
Ses02F_script02_2_M025,[213.9900-215.8600]:,You wanna get married again?,fru,3.0,3.5,2.5,1
Ses02F_script02_2_F025,[215.2100-216.2000]:,No.,fru,2.5,2.0,2.5,1
Ses02F_script02_2_M026,[215.9000-218.3600]:,What?  What?  You want a divorce?,fru,2.0,3.5,3.0,1
Ses02F_script02_2_F026,[217.4100-218.6800]:,No.,fru,2.0,3.5,3.5,1
Ses02F_script02_2_M027,[218.4100-219.7400]:,A vacation?,fru,2.0,3.5,3.5,1
Ses02F_script02_2_F027,[218.9300-220.1400]:,No.,fru,2.0,4.0,4.0,1
Ses02F_script02_2_M028,[219.7500-226.5400]:,"A new carpet?  A poodle?  Ice cream?  Back rub?  A suicide pact?  What?  What?  Carla, what the hell do you want?",fru,2.0,4.0,4.0,1
Ses02F_script02_2_M029,[228.2000-238.9600]:,"Well, welcome to the human race.  Do you think this is what I had in mind when I proposed?  That four years down the road, we'd be at the beach yelling at each other over fish?",ang,2.0,4.5,4.5,2
Ses02F_script02_2_M031,[250.8900-266.4300]:,"No, Carla, I'm just like you.  I thought it was gonna be all peaches and roses and sand in our toes and wind in our hair and the fish will always come and the bills will pay themselves and we'll have three fat rosy kids and ha, ha, baby, the joke's on us",sad,2.5,3.0,4.0,3
Ses02F_script02_2_M032,[266.4400-269.3900]:,"'cause you know what you get, Carla?  You know what you get?  This.",fru,2.0,3.5,4.0,1
Ses02F_script02_2_M033,[273.8200-275.0800]:,"Yes, it is.",neu,3.0,2.5,3.0,0
Ses02F_script02_2_M034,[280.1300-281.2200]:,Right.,neu,2.5,2.5,4.0,0
Ses02F_script02_2_F031,[281.5765-286.6000]:,Well.  This isn't anything like I thought anything would be like.,sad,1.5,4.0,3.5,3
Ses02F_script02_2_M035,[286.3300-288.2900]:,"I know, me neither.",sad,2.5,3.0,3.0,3
Ses02F_script02_2_M036,[302.9300-305.0600]:,I'm doing the best I can.,sad,2.0,2.5,3.5,3
Ses02F_script02_2_F033,[305.3800-308.7200]:,"I know that, Augie.  Really, I do.",sad,2.5,3.5,3.0,3
Ses02F_script02_2_F034,[308.7500-324.1000]:,"I know that you meant this to be special and nice and the sand and the moon and all, but I just couldn't help thinking about being somewhere else.",sad,1.5,3.0,3.5,3
Ses02F_script02_2_M037,[325.0600-327.9300]:,Maybe if you were with somebody else too.,sad,2.0,2.5,3.5,3
Ses02F_script02_2_F035,[327.1500-328.7700]:,I didn't say that.,sad,2.0,2.0,2.5,3
Ses02F_script02_2_M038,[328.3800-333.7100]:,"No, I know.  But still.  I know I don't make you happy.",sad,2.0,3.0,3.0,3
Ses02F_script02_2_M039,[337.8400-339.0300]:,Yeah?,sur,3.0,2.5,3.0,5
Ses02F_script02_2_F038,[342.0800-350.2000]:,You're the one who probably wishes you were with someone else.  Someone who--you'd rather enjoy yourself and didn't take everything so hard.,sad,1.5,3.0,4.5,3
Ses02F_script02_2_M041,[364.8100-370.5600]:,"I don't know.  It seemed like a pretty good spot to me.  I mean, look at the view you have of the moon from here.",hap,4.0,3.0,3.0,4
Ses02F_script02_2_M042,[378.2800-380.2100]:,"Well, look what we have here.",hap,4.0,3.5,3.5,4
Ses02F_script02_2_F041,[379.8700-382.7600]:,"Augie, you brought refreshments.",hap,4.0,4.0,3.5,4
Ses02F_script02_2_M043,[382.4300-384.0800]:,It's not champagne.,hap,4.0,3.0,3.0,4
Ses02F_script02_2_F042,[383.7000-387.6000]:,"Well, then we don't need glasses.",hap,4.0,3.0,3.5,4
Ses02F_script02_2_F043,[393.4100-402.2600]:,No.  I think you might be right.  Maybe this is the spot after all.,hap,4.0,3.0,3.5,4
Ses02F_script02_2_F044,[405.9300-408.2600]:,"Augie, I'm sorry.",sad,2.5,3.5,3.5,3
Ses02F_script02_2_M045,[407.0800-411.6900]:,Shh.  If we're very quiet the fish might come.,hap,3.5,2.5,3.5,4
Ses02F_script02_2_F045,[412.1500-413.9200]:,Or not.,hap,4.0,2.5,2.5,4
Ses02F_script02_2_M046,[414.0500-415.6400]:,Or not.,hap,4.0,3.0,2.5,4
Ses02F_script03_1_F000,[006.3800-007.6300]:,Do you think it's them?,fea,3.0,3.3333,2.3333,7
Ses02F_script03_1_M001,[007.7100-008.8000]:,I wonder.,neu,3.0,2.0,2.6667,0
Ses02F_script03_1_F001,[008.7500-012.4900]:,"Well, nobody know we're here except Freda and she wouldn't ring up.",fea,3.0,3.0,2.6667,7
Ses02F_script03_1_F002,[013.7700-016.2400]:,What're we gonna do?,fea,3.0,3.0,2.0,7
Ses02F_script03_1_M004,[020.6500-022.1800]:,I don't care then.,neu,3.6667,2.3333,4.0,0
Ses02F_script03_1_M005,[023.9100-028.8000]:,Hello?  Hello?  What?  Wrong number.,neu,3.3333,4.0,2.6667,0
Ses02F_script03_1_F005,[028.4000-032.4500]:,"Ah, it send shivers up my spine.",exc,3.6667,4.0,2.3333,6
Ses02F_script03_1_F006,[034.4900-036.7600]:,Behave exquisitely.,hap,4.0,3.3333,1.6667,4
Ses02F_script03_1_M007,[036.5300-038.4000]:,With the most perfect poise?,neu,3.6667,2.6667,3.0,0
Ses02F_script03_1_F007,[037.7000-041.5500]:,"Oh, of course.  I shall probably do a court curtsy.",hap,4.0,3.3333,2.3333,4
Ses02F_script03_1_M008,[041.2000-045.8900]:,Things that ought to matter dreadfully don't matter at all when one's happy.  Do they?,neu,3.6667,2.6667,3.0,0
Ses02F_script03_1_F008,[045.2300-048.8800]:,What's so horrible is that one can't stay happy.,hap,2.6667,2.3333,2.0,4
Ses02F_script03_1_M009,[048.1500-050.1700]:,"Oh, darling, don't say that.",neu,3.0,2.0,3.6667,0
Ses02F_script03_1_F009,[049.6500-053.3200]:,It's true.  The whole business is a very poor joke.,hap,2.6667,2.6667,2.6667,4
Ses02F_script03_1_M010,[053.1800-056.9300]:,"Meaning that sacred and beautiful thing, love?",neu,3.6667,3.0,2.6667,0
Ses02F_script03_1_F010,[056.3800-058.7300]:,"Yes, meaning just that.",hap,3.3333,2.0,3.0,4
Ses02F_script03_1_M012,[068.0000-070.9400]:,"You mustn't be serious, my dear one.  That's just what they want.",neu,3.6667,3.3333,3.6667,0
Ses02F_script03_1_F012,[070.5100-071.7600]:,Who's they?,neu,3.6667,2.3333,2.6667,0
Ses02F_script03_1_M013,[071.4200-078.6400]:,All those futile moralists that try to make life unbearable.  Laugh at them.  Be flippant.  Laugh at everything.  All their sacred shibboleths.,neu,3.3333,3.6667,3.6667,0
Ses02F_script03_1_M014,[078.6500-082.1400]:,Flippancy brings out the acid in their damn sweetness and light.,neu,3.6667,3.6667,3.6667,0
Ses02F_script03_1_F013,[081.7800-084.7900]:,"If I laugh at everything, then I must laugh at us too.",neu,3.6667,2.6667,2.3333,0
Ses02F_script03_1_M015,[084.5000-087.2800]:,"Certainly, you must.  We're figures of fun, alright.",neu,3.6667,2.6667,3.3333,0
Ses02F_script03_1_F014,[086.9300-092.2600]:,"Well how long will it last us, this ludicrous overbearing love of ours.",neu,4.0,2.6667,2.0,0
Ses02F_script03_1_M016,[092.0100-093.3700]:,Who knows.,neu,3.3333,2.0,2.6667,0
Ses02F_script03_1_F015,[093.3100-096.5400]:,"Well, shall we always want to bicker and fight?",neu,3.6667,2.3333,2.3333,0
Ses02F_script03_1_M017,[096.2300-099.7400]:,"No, that desire will fade.  Along with our passion.",neu,3.0,2.3333,2.6667,0
Ses02F_script03_1_F016,[099.0400-101.3500]:,"Oh, dear, shall we like that?",neu,3.3333,2.6667,2.0,0
Ses02F_script03_1_M018,[101.1000-103.3300]:,Depends on how well we've played.,neu,3.3333,2.3333,3.0,0
Ses02F_script03_1_F017,[103.0200-109.2400]:,"Well, what happens if one of us dies?  I mean, does the one that's left still laugh?",neu,2.6667,3.0,2.3333,0
Ses02F_script03_1_M019,[108.6800-111.9600]:,Yes.  Yes. With all his might.,exc,3.6667,3.0,4.0,6
Ses02F_script03_1_M020,[112.7900-118.2800]:,"No. No, it isn't.  Death is very laughable.  Such a cunning little mystery.  All done with mirrors.",exc,3.6667,3.3333,3.3333,6
Ses02F_script03_1_F019,[117.5200-119.9700]:,"Darling, I believe you're talking nonsense.",hap,4.0,3.3333,2.6667,4
Ses02F_script03_1_M021,[119.4800-122.2200]:,So is everyone else in the long run.,neu,3.0,2.6667,3.0,0
Ses02F_script03_1_M022,[122.2600-136.2100]:,"Let's be superficial and pity the poor philosophers.  Let's blow our trumpets and squeakers and enjoy the party as much as we can.  Like quite idiotic, very small school children.  Let's savor the delight of the moment.",exc,4.0,3.0,4.3333,6
Ses02F_script03_1_M023,[136.2304-140.6300]:,"Come and kiss me, darling, before your body rots and worms pop in and out of your eye sockets.",exc,4.0,3.0,4.6667,6
Ses02F_script03_1_F020,[140.2000-142.4300]:,"Elliott, worms don't pop.",hap,3.3333,2.6667,3.0,4
Ses02F_script03_1_M024,[142.8200-153.4900]:,"I don't care what you do.  See, you could paint yourself green and dance naked in the Place Vendome and rush off madly with all the men in the world and I shan't say a word.  As long as you love me best.",neu,4.0,2.6667,3.3333,0
Ses02F_script03_1_F021,[152.9500-160.5700]:,"Oh, thank you, dear.  The same applies to you except that if I catch so much as looking at another woman, I'll kill you.",hap,4.0,2.6667,3.6667,4
Ses02F_script03_1_M025,[160.0100-162.6809]:,You remember that awful scene we had in Venice?,neu,3.0,2.6667,2.6667,0
Ses02F_script03_1_F022,[162.7044-164.7400]:,Which particular one?,hap,4.0,2.3333,2.0,4
Ses02F_script03_1_M026,[164.3100-169.1600]:,The one when you bought that little painted wooden snake in the Piazza and put it on my bed.,neu,3.3333,3.0,2.3333,0
Ses02F_script03_1_F023,[168.4300-173.2000]:,Charles.  That was his name.  Charles.  He did wriggle so beautifully.,hap,4.3333,3.3333,2.3333,4
Ses02F_script03_1_F024,[174.1900-179.8500]:,"Yes, I know you did.  You threw it out of the window into the Grand Canal.  I don't think I'll ever forgive you for that.",hap,4.0,2.6667,3.0,4
Ses02F_script03_1_M028,[179.5600-181.6500]:,How long did that row last?,neu,3.0,2.6667,2.6667,0
Ses02F_script03_1_F025,[181.0200-183.9300]:,It went in intermittently for days.,hap,4.0,3.0,3.3333,4
Ses02F_script03_1_M029,[183.4900-189.0200]:,The worst one was in Cannes when your curling iron burnt a hole in my new dressing gown.,neu,3.6667,3.0,3.3333,0
Ses02F_script03_1_F026,[187.4000-191.6500]:,It burned my comb too and all the towels in the bathroom.,hap,4.3333,4.0,3.0,4
Ses02F_script03_1_F027,[192.5900-195.5500]:,That was the first time you ever hit me.,neu,3.3333,3.0,3.3333,0
Ses02F_script03_1_M031,[195.4500-197.6700]:,I didn't hit you very hard.,neu,4.0,2.6667,3.0,0
Ses02F_script03_1_F028,[197.0900-204.3900]:,"The manager came in and found us rolling around on the floor, biting and scratching like panthers.",hap,4.6667,4.0,3.0,4
Ses02F_script03_1_M032,[202.7400-205.3600]:,"Oh, I'll never forget his face.",exc,4.0,3.3333,3.0,6
Ses02F_script03_1_F029,[204.8400-208.5300]:,It was ridiculous.  Completely ridiculous.,exc,4.0,2.6667,2.6667,6
Ses02F_script03_1_M033,[208.2100-210.4500]:,We were very much younger then.,neu,3.6667,2.3333,3.0,0
Ses02F_script03_1_M034,[212.4200-217.2000]:,"As a matter of fact, the real cause of that row was Peter Burden.",neu,3.0,2.0,3.3333,0
Ses02F_script03_2_M000,[004.6200-008.2800]:,"As a matter of fact, the real cause of that row was Peter Burden.",neu,3.0,2.5,2.5,0
Ses02F_script03_2_M001,[009.5800-012.6200]:,I knew nothing of the sort.  You took presents from him.,neu,2.5,3.5,2.5,0
Ses02F_script03_2_M006,[036.6600-037.8300]:,What of it?,ang,2.0,4.5,3.0,2
Ses02F_script03_2_M007,[041.8500-043.9400]:,"Well, what about me?",ang,2.0,4.0,2.0,2
Ses02F_script03_2_F007,[043.8300-048.3300]:,"Well, if you hadn't been so suspicious and nosey, you never would have known a thing about it.",neu,2.5,3.0,2.5,0
Ses02F_script03_2_M009,[052.7500-056.9000]:,"Me, too.  Bored stiff.  You want some brandy?",neu,3.0,2.5,3.0,0
Ses02F_script03_2_M011,[063.2000-066.6400]:,No particular reason.  Anyhow they were very small ones.,neu,3.0,2.5,2.5,0
Ses02F_script03_2_F011,[066.6500-070.7700]:,Just seems so silly to go on and on and on with such a thing.,neu,2.5,3.0,3.0,0
Ses02F_script03_2_M012,[070.5000-076.5400]:,You can hardly call three liquor glasses in a whole evening going on and on and on.,fru,2.5,2.5,3.5,1
Ses02F_script03_2_F012,[075.5400-078.3300]:,"Well, it's become a habit with you.",neu,2.5,3.0,2.5,0
Ses02F_script03_2_M013,[077.5600-082.4000]:,"You needn't be so grand, just because you don't happen to want any yourself at the moment.",ang,2.5,3.5,3.5,2
Ses02F_script03_2_F013,[081.2800-083.3600]:,Don't be so stupid.,ang,2.0,3.5,3.0,2
Ses02F_script03_2_F014,[083.4100-084.5500]:,What?,ang,2.0,4.0,3.0,2
Ses02F_script03_2_M015,[084.3600-085.3200]:,Nothing.,fru,2.5,1.5,2.5,1
Ses02F_script03_2_F016,[096.5600-101.8200]:,"A woman's job is to allure the man.  Watch me a minute, will you?",exc,2.5,2.5,3.0,6
Ses02F_script03_2_F017,[103.8300-105.5700]:,"No, it isn't.",fru,2.5,3.0,3.0,1
Ses02F_script03_2_M019,[104.8700-106.2500]:,"Yes, it is.",fru,2.5,2.5,3.0,1
Ses02F_script03_2_F018,[105.6100-107.7100]:,"Oh, be quiet.",ang,2.5,3.5,3.5,2
Ses02F_script03_2_F019,[110.5000-113.5500]:,Doesn't seem to have worked such wonders with you.,fru,2.5,2.0,3.0,1
Ses02F_script03_2_M021,[113.0700-115.8000]:,"Snap, snap, snap, like a little adder.",fru,2.0,3.5,3.0,1
Ses02F_script03_2_F020,[115.5200-117.5600]:,"Adders don't snap, they sting.",ang,2.5,3.0,3.5,2
Ses02F_script03_2_M022,[117.1700-121.1900]:,Nonsense.  They have a little bag of venom behind their fangs and they snap.,fru,2.5,3.5,3.5,1
Ses02F_script03_2_M023,[121.2100-122.6900]:,They snap.,fru,2.5,4.0,3.0,1
Ses02F_script03_2_F022,[122.0300-127.8900]:,"I don't care, do you understand?  I don't care.  I don't care if they bark or roll about like hoops.",fru,2.0,3.5,3.5,1
Ses02F_script03_2_F024,[137.7400-139.5100]:,Mind your own business.,fru,2.5,2.0,3.0,1
Ses02F_script03_2_F025,[145.0800-146.9400]:,You're quite insufferable,ang,2.5,2.5,3.0,2
Ses02F_script03_2_F026,[146.9600-148.6000]:,I expect it's because you're drunk.,fru,2.5,2.5,3.5,1
Ses02F_script03_2_M027,[148.2500-150.5600]:,I'm not in the least drunk.,ang,2.5,3.5,3.0,2
Ses02F_script03_2_M028,[151.6600-159.6700]:,"As I mentioned before, I have had three minute liquor glasses of brandy the whole evening long.  A child of two couldn't get drunk on that.",fru,2.5,3.5,3.5,1
Ses02F_script03_2_F028,[158.7800-163.6000]:,"On the contrary, a child of two could get violently drunk on only one glass of brandy.",fru,2.5,3.5,3.5,1
Ses02F_script03_2_M029,[163.2700-168.5800]:,"Oh, very interesting.  How about a child of four?  A child of six?  Or a child of nine?",fru,2.5,3.0,3.0,1
Ses02F_script03_2_F029,[167.4500-169.2900]:,Shut up.,ang,2.0,4.0,3.5,2
Ses02F_script03_2_M030,[168.6300-172.8500]:,"We could get a good debate going about this, don't you think?  Intemperate tots.",ang,2.5,3.5,3.0,2
Ses02F_script03_2_F030,[171.8500-175.6300]:,"Not very funny, dear.  You'd better have some more brandy.",fru,2.5,2.0,3.0,1
Ses02F_script03_2_F031,[181.6200-183.1100]:,Why?,ang,2.5,2.0,3.0,2
Ses02F_script03_2_M033,[183.1000-186.5000]:,Because it's late and it'll annoy the people upstairs.,fru,2.0,2.5,3.0,1
Ses02F_script03_2_F032,[185.6900-189.7300]:,There aren't any people upstairs.  It's a photographer's studio.,fru,2.5,3.0,3.5,1
Ses02F_script03_2_M034,[189.3400-191.9800]:,There are people downstairs I suppose?,fru,2.5,3.0,3.0,1
Ses02F_script03_2_M035,[193.3500-196.0100]:,This is no time of the year for Tunis.,fru,2.5,3.5,3.0,1
Ses02F_script03_2_F034,[195.9400-198.2100]:,"Turn it on again, please.",ang,2.0,3.0,3.0,2
Ses02F_script03_2_M036,[197.8700-199.9800]:,I'll do no such thing.,ang,2.5,3.5,3.0,2
Ses02F_script03_2_F035,[199.5800-204.2100]:,"Very well, if you insist on being boorish and idiotic.",ang,2.0,3.0,3.0,2
Ses02F_script03_2_M037,[203.7700-206.4800]:,Turn it off.  It's driving me mad.,ang,1.5,2.5,3.5,2
Ses02F_script03_2_F036,[205.6900-209.7500]:,You are far too temperamental.  Try to control yourself.,ang,2.0,3.5,3.5,2
Ses02F_script03_2_M038,[208.9600-210.2100]:,Turn it off.,ang,1.5,3.0,4.0,2
Ses02F_script03_2_F037,[209.8900-212.3000]:,Stop it.  Go away.  I hate you.,ang,1.5,4.5,3.5,2
Ses02F_script03_2_M039,[211.3600-213.5500]:,"Amanda, listen. listen",ang,2.0,2.5,3.0,2
Ses02F_script03_2_F038,[212.3400-217.8700]:,"Listen?  Listen, indeed.  I am sick and tired of listening to you, damn sadistic bully.",ang,1.5,4.0,3.5,2
Ses02F_script03_2_M040,[217.1900-219.3200]:,"Very amusing, indeed.",fru,2.0,2.5,3.0,1
Ses02F_script03_2_F039,[218.4900-224.8200]:,"I hate you.  Stop it.  Stop it.  I hate you, do you hear?  You're conceited and overbearing and utterly impossible.",ang,1.5,4.5,3.5,2
Ses02F_script03_2_M041,[224.2000-231.0300]:,"You're a vile, tempered, loose living, wicked little beast and I hope to never see you again as long as I live.",ang,1.5,4.5,4.0,2
Ses02F_script03_2_F040,[230.0800-234.2200]:,This is the end.  Finally and forever.  Do you hear me?  The end.,ang,1.5,4.5,4.0,2
Ses02F_script03_2_M042,[233.6300-235.6200]:,You're not going like this.,ang,2.0,3.5,3.5,2
Ses02F_script03_2_F041,[234.4800-236.4400]:,"Oh Yes, I am.",ang,1.5,4.0,4.0,2
Ses02F_script03_2_M043,[235.8700-237.3600]:,You're not.,ang,2.0,3.5,4.0,2
Ses02F_script03_2_F042,[236.4800-241.0600]:,I am.  Let go of me.  You're a cruel fiend and I hate and loathe you.,ang,1.5,4.5,4.0,2
Ses02F_script03_2_M044,[239.2200-241.1500]:,Shut up. Shut up.,ang,1.5,4.5,4.0,2
Ses02F_script03_2_M045,[241.7900-243.5800]:,I wouldn't-- I wouldn't marry--,ang,2.0,4.0,3.5,2
Ses02F_script03_2_M046,[243.5900-246.4400]:,I wouldn't marry you if you came in crawling on your knees,ang,2.0,4.0,3.5,2
Ses02F_script03_2_F043,[241.0800-251.9500]:,Thank God I realized what you are-- I'd never marry you again ever in my life. You're a cruel fiend and I hate you. You're a beast. You're a beast--I hate you. Stop it.  Stop it.,ang,1.5,5.0,4.0,2
Ses02F_script03_2_M047,[246.4700-250.6200]:,You're a evil vampire and I hope to God I never see you again as long as I live.,ang,1.5,4.0,4.0,2
Ses02M_impro01_M000,[003.5000-006.4410]:,All right. Finally. Here you go.,fru,4.0,2.5,2.5,1
Ses02M_impro01_F000,[005.3200-007.3580]:,"Hi, How can I help you?",neu,4.0,3.0,3.0,0
Ses02M_impro01_M001,[007.3400-010.0000]:,"Yea. I just want to get this done,",neu,3.5,3.0,2.5,0
Ses02M_impro01_F001,[010.3710-011.6114]:,"Sure, um",neu,3.5,2.5,2.5,0
Ses02M_impro01_M002,[010.0100-012.2924]:,get my new license.,neu,3.0,3.5,2.5,0
Ses02M_impro01_F002,[011.6114-014.6855]:,do you have two forms of ID with you?,neu,3.0,3.0,3.0,0
Ses02M_impro01_M003,[014.3252-017.6205]:,"Um, no, I got my driver's license though.",neu,3.5,3.0,2.5,0
Ses02M_impro01_F003,[017.8190-024.7376]:,"I actually need two forms of ID. I need either a passport or a birth certificate, or social security card. I'm sorry.",neu,3.0,3.0,3.0,0
Ses02M_impro01_M004,[024.5138-028.1500]:,"Uh, sorry, I forgot them. I mean I've got to -",neu,3.0,3.5,3.0,0
Ses02M_impro01_F004,[027.9800-029.6220]:,Well,neu,3.0,3.0,3.0,0
Ses02M_impro01_M005,[028.2300-031.2973]:,well is the dri-driver's license going to work?,neu,2.5,3.5,2.5,0
Ses02M_impro01_F005,[030.0939-036.9427]:,I- I can take your driver's license but I need another form of ID in order to process this paper work.,neu,3.0,3.5,3.0,0
Ses02M_impro01_M006,[036.8679-039.1999]:,"Okay, so what are you saying? What-",fru,3.0,3.5,3.0,1
Ses02M_impro01_F006,[038.8667-044.0823]:,"Um, that you would need to go home and get another form of ID and come back.",neu,2.5,3.0,2.5,0
Ses02M_impro01_M007,[044.2341-052.4300]:,"What? I- You telling me I waited in that huge line to go and sit down and get my number called, like after",ang,1.5,4.0,4.0,2
Ses02M_impro01_F007,[053.1100-054.9300]:,"Well, I'm sorry sir but",fru,2.5,2.5,3.0,1
Ses02M_impro01_M008,[052.4400-054.5300]:,three hours and,ang,2.0,3.5,3.5,2
Ses02M_impro01_F008,[054.9400-058.3100]:,you need to bring two forms of ID there is nothing we can do about it.,fru,2.5,3.0,3.0,1
Ses02M_impro01_M009,[057.3791-064.1421]:,Shouldn't they have like told us about that? I mean why - why would they make me go and wait three hours if I have got to go and do it again?,ang,1.5,4.5,4.0,2
Ses02M_impro01_F009,[060.0864-061.5056]:,"Well, it's actually-",fru,3.0,2.5,3.0,1
Ses02M_impro01_F010,[063.2229-068.4976]:,"It's standard that you bring a couple of forms of ID, I'm sorry.",fru,2.5,2.5,3.5,1
Ses02M_impro01_M010,[066.9831-073.6261]:,"It's standard? I mean I don't work at the D.M.V. how am I supposed to know that, like, I stand in line, I get my",ang,2.0,4.0,3.5,2
Ses02M_impro01_F011,[071.2864-074.6495]:,"Well, I'm sorry, sir, but we're not responsible.",fru,2.5,3.0,2.5,1
Ses02M_impro01_M011,[074.2423-076.2871]:,"I filled out the application right, didn't I?",ang,2.5,4.0,3.5,2
