Session_ID,Time_Record,Transcription,Sentiment,Valence,Activation,Dominance,discrete
Ses04M_impro08_F002,[034.0959-039.7300]:,"Uh. Yeah, I just gave it to the automated thing like five times.",fru,2.5,3.5,3.5,1
Ses04M_impro08_M003,[038.0800-043.6400]:,I'm going to need it again.  I need to look at your file.  If you want me to look at your file--,fru,2.0,3.0,3.5,1
Ses04M_impro08_F003,[041.6100-045.5300]:,Okay.  three two three six nine seven five zero six six.  Can we move on?,fru,2.5,3.5,3.5,1
Ses04M_impro08_M004,[044.9400-046.1000]:,Okay.,neu,3.0,2.5,3.0,0
Ses04M_impro08_M005,[046.1300-050.0300]:,"Umm, Miss Aruckman",neu,3.0,3.0,3.5,0
Ses04M_impro08_M006,[050.5313-055.7900]:,I am seeing the two hundred dollar charge.,neu,2.5,3.0,3.0,0
Ses04M_impro08_F006,[054.5500-063.8900]:,"Yes, and I've been through all of the menus, pushed one and star and pound and all of that stuff and I'm just trying to get through to a person who can",fru,2.0,4.0,4.0,1
Ses04M_impro08_M007,[068.9900-073.4300]:,Well I'm looking at these.,fru,3.0,2.5,3.0,1
Ses04M_impro08_F007,[063.9300-070.3600]:,"take off the charges that came from like Nebraska or wherever because, obviously, I didn't make those.",fru,2.0,4.5,3.5,1
Ses04M_impro08_F008,[070.5300-075.6300]:,So can you please refund the mischarged charges,fru,2.0,3.5,4.0,1
Ses04M_impro08_M008,[074.7300-078.0600]:,So you're saying that you didn't make these calls.,neu,3.0,3.0,3.5,0
Ses04M_impro08_F009,[076.4700-081.4900]:,I did not make the calls from B.F.E. Nebraska.,fru,2.0,3.5,4.0,1
Ses04M_impro08_M009,[080.9300-086.9000]:,"Well I mean, I'm supposed to use discretion in the situation and, um--",fru,3.0,2.5,3.5,1
Ses04M_impro08_F010,[085.6500-088.5300]:,So could you discretion it back?,fru,2.5,3.5,4.0,1
Ses04M_impro08_M010,[088.0300-093.4100]:,All I can do for you right now is give you a hundred dollars.,neu,2.5,3.0,3.5,0
Ses04M_impro08_F011,[093.2200-095.8300]:,"Okay, but that's like half",fru,2.0,3.5,4.0,1
Ses04M_impro08_M011,[097.6900-099.3800]:,What I can,neu,3.5,2.5,2.5,0
Ses04M_impro08_F012,[095.8300-100.7668]:,of the money that I was charged that I didn't make those calls.,fru,1.5,3.5,4.5,1
Ses04M_impro08_M012,[100.4200-109.0700]:,What I can do for you is give you a hundred dollars right now and fill out complaint form,neu,3.0,3.0,3.0,0
Ses04M_impro08_M013,[109.0954-114.4400]:,which you- which you'll have to go into a local Verizon dealer--  or Sprint.,neu,3.0,2.5,3.0,0
Ses04M_impro08_F013,[111.1800-118.4000]:,"Okay, no, look, I- I- I- I'm really -- I'm trying to be patient.  I know this isn't your fault.  I know that you didn't do it",fru,2.0,3.5,3.0,1
Ses04M_impro08_F014,[118.4100-125.2300]:,"but, at the same time, I have been through an hour of little robot voices telling me what I needed to do.",fru,2.0,4.0,4.0,1
Ses04M_impro08_M014,[125.7300-128.0000]:,"Ma'am, I understand that.",fru,3.0,2.5,2.5,1
Ses04M_impro08_M015,[130.8000-147.7700]:,"Ma'am, I - I - I understand that. I understand that. What I can do for you right now is what I'm telling you is that I can do- I can give you a hundred dollars back and then you'll have to fill out a complaint form and then you'll get -- there'll be some investigation. Some men will show up at your house and go through your things.",fru,2.5,3.0,3.5,1
Ses04M_impro08_F016,[147.6700-149.7900]:,Excuse me?,fru,3.5,3.5,3.5,1
Ses04M_impro08_M016,[147.7900-151.0300]:,And then then you'll get some money back.,fru,3.0,3.0,3.0,1
Ses04M_impro08_F017,[150.5900-152.8600]:,How long does that take?,fru,2.5,3.0,2.5,1
Ses04M_impro08_M017,[152.9700-157.9313]:,A few weeks.  You won't even know that they were there.,neu,3.0,3.0,3.0,0
Ses04M_impro08_F018,[157.4243-163.4661]:,I have to wait a few weeks for people come go through my things to get the money back that I didn't spend?,fru,1.5,4.0,3.5,1
Ses04M_impro08_M018,[162.8746-169.7300]:,"Okay.  You know what?  I just don't feel like doing this anymore.  Um, you can have all the money back, two hundred dollar, right now.",fru,2.0,3.5,3.0,1
Ses04M_impro08_F019,[169.6000-170.9700]:,Really?,sur,3.5,3.0,2.5,5
Ses04M_impro08_M019,[170.5400-177.4600]:,"Yeah.  That's fine.  I just -- that's fine. Yeah, I mean, it doesn't make any difference to me.  I mean, it's not like it's going to cost my job or anything.",neu,3.0,3.5,3.5,0
Ses04M_impro08_F020,[172.4800-174.8600]:,You're just going to put it back on my account.,neu,3.0,2.0,2.5,0
Ses04M_impro08_M020,[177.4600-183.7900]:,"I mean, technically, that's policy.  But, like, I mean, I don't really care about -- nobody really cares about policy here.",neu,3.0,3.5,3.0,0
Ses04M_impro08_F021,[183.1300-185.3500]:,So you're just going to take care of this for me?,sur,4.0,3.0,2.5,5
Ses04M_impro08_M021,[184.8400-186.2900]:,Sure.,neu,3.0,2.5,2.5,0
Ses04M_impro08_F022,[185.6000-187.7700]:,"Oh, my God, thank you so much.",hap,4.0,3.0,4.0,4
Ses04M_impro08_M022,[187.4800-188.7100]:,You're welcome.,neu,3.5,2.5,3.0,0
Ses04M_impro08_F023,[187.7800-192.7400]:,"I really appreciate this. I know it's not policy or whatever but, seriously",hap,3.5,3.0,4.0,4
Ses04M_impro08_M023,[191.5700-194.5300]:,"No, no, no, it's cool.  It's cool.  It's cool.  So, um",neu,3.0,3.5,3.0,0
Ses04M_impro08_F024,[193.1700-195.6600]:,make my life a lot easier.,hap,4.0,4.0,3.5,4
Ses04M_impro08_M024,[194.7200-198.3000]:,"You know, so- I mean, are you doing anything later?  Or um",neu,3.5,3.0,2.5,0
Ses04M_impro08_F025,[197.4600-200.5700]:,Really?,sur,4.5,4.0,3.0,5
Ses04M_impro08_M025,[199.8300-209.8200]:,"Oh, I don't know.  I mean, I don't know.  I just thought, you know, maybe you want to get some co--I mean, I'm actually -- wait, where do you live?  Oh, you're in Los Angeles, I see.  Oh, no, that sucks 'cause I'm in, actually in Alabama.",neu,3.5,4.0,3.0,0
Ses04M_impro08_M026,[210.1800-214.3200]:,"God, that's like a whole problem with like-- But, no, I mean, hey-- if you ever",neu,3.0,4.0,2.5,0
Ses04M_impro08_M027,[214.3353-223.2800]:,"if you ever come out to Montgomery, I mean, you know, just -- just call up, you know, call up the operator and I'll-- I'll be here. So, um.",neu,3.5,3.0,3.0,0
Ses04M_impro08_F027,[217.2506-218.8700]:,I'll,neu,3.5,3.5,2.0,0
Ses04M_impro08_F028,[219.0000-223.2100]:,"call up the Sprint call center and, uh, you know. cool",neu,3.5,2.0,2.5,0
Ses04M_impro08_M028,[227.2200-228.5400]:,Alright. Take Care.,neu,3.5,2.5,3.0,0
Ses04M_impro08_F030,[228.2400-229.1073]:,You too.,neu,3.0,2.5,2.5,0
Ses04M_script01_1_F000,[008.3600-013.4200]:,What's he going to say?  Maybe we ought to tell him before he sees it.,neu,2.5,3.5,2.0,0
Ses04M_script01_1_M000,[012.6200-014.9500]:,He saw it.,neu,2.5,2.0,3.0,0
Ses04M_script01_1_M001,[017.4500-019.4152]:,He was out here when it broke.,neu,2.5,2.0,2.5,0
Ses04M_script01_1_F002,[019.1300-020.9592]:,When?,sur,2.5,3.0,1.5,5
Ses04M_script01_1_F007,[060.7100-065.5200]:,He's getting just like after he died.  What's the meaning in that?,sad,2.0,3.0,2.5,3
Ses04M_script01_1_M007,[064.7000-072.0641]:,"I don't know the meaning of it, mom.  But I know one thing; we made a terrible mistake with dad.",fru,2.0,3.0,3.5,1
Ses04M_script01_1_F008,[071.4600-073.2221]:,What?,sur,2.5,3.0,1.5,5
Ses04M_script01_1_F009,[077.3300-079.9800]:,"What do you mean, dishonest?",fru,2.0,2.5,2.5,1
Ses04M_script01_1_F010,[085.1700-087.4000]:,What do you want to do?  Argue with him?,fru,2.0,2.5,3.0,1
Ses04M_script01_1_M010,[086.6900-092.1000]:,I don't want to argue with him but it's time he realized that nobody believes Larry's alive anymore.,fru,2.0,3.5,3.0,1
Ses04M_script01_1_F011,[104.0500-106.2100]:,You can't say that to him.,ang,2.5,3.5,3.0,2
Ses04M_script01_1_M013,[105.1900-106.9187]:,We've gotta say it to him.,ang,2.5,3.0,3.5,2
Ses04M_script01_1_F012,[106.7200-109.4900]:,How are you going to prove it?  Can you prove it?,ang,2.5,3.5,2.0,2
Ses04M_script01_1_M014,[108.7300-113.0300]:,"For God's sake, three years.  Nobody comes back after three years.  It's insane.",ang,2.5,3.5,3.5,2
Ses04M_script01_1_F013,[112.1200-120.3900]:,"To you it is and to me, but not to him.  You can talk yourself blue in the face, but there's no body and no grave, so where are you?",ang,2.0,3.5,3.5,2
Ses04M_script01_1_M016,[127.6600-133.5100]:,"Alright, alright, alright.  Listen.  You know why I asked Annie here don't you?",fru,2.5,3.0,3.0,1
Ses04M_script01_1_F015,[132.7200-134.7331]:,Why?,neu,2.5,2.0,1.5,0
Ses04M_script01_1_M017,[134.1600-136.2800]:,You know why.,fru,2.5,2.5,3.5,1
Ses04M_script01_1_M018,[139.6800-142.1800]:,Going to ask her to marry me.,neu,2.5,2.5,2.5,0
Ses04M_script01_1_F017,[141.7500-144.6100]:,"Well that's only your business, Chris.",neu,2.5,2.5,2.5,0
Ses04M_script01_1_M019,[144.0800-147.0300]:,You know it's not only my business.,fru,1.5,3.0,3.5,1
Ses04M_script01_1_F018,[146.7000-149.7400]:,What do you want me to do?  You're old enough to know your own mind.,ang,2.0,3.0,3.0,2
Ses04M_script01_1_F019,[151.3089-154.9400]:,Well you want to make sure your father isn't going to have --,neu,3.0,2.5,2.5,0
Ses04M_script01_1_M021,[153.7600-157.4947]:,"Well, then you know it's not only my business.",ang,2.0,3.5,3.5,2
Ses04M_script01_1_F020,[157.1000-159.3310]:,I'm just saying.,fru,2.5,3.0,3.0,1
Ses04M_script01_1_M022,[158.9800-168.5000]:,"Sometimes you infuriate me, you know that?  Isn't it your business, too, if I tell this to father and he throws a fit about it?  You have such a talent for ignoring things.",ang,1.5,3.5,3.5,2
Ses04M_script01_1_F021,[167.4800-171.6000]:,I ignore what I got to ignore.  The girl is Larry's girl.,ang,2.0,3.5,3.5,2
Ses04M_script01_1_M023,[170.2500-172.6000]:,She's not Larry's girl.,fru,2.0,3.0,4.0,1
Ses04M_script01_1_F022,[172.1200-176.8251]:,"From father's point of view, he's not dead.  And you have no right to take his girl.",ang,2.0,4.0,3.5,2
Ses04M_script01_1_F023,[176.9217-183.3008]:,"Now you can go on from there if you know where to go. But I'm telling you I don't know where to go.  See, I don't know.",fru,2.0,3.5,3.0,1
Ses04M_script01_1_F024,[183.3700-185.8621]:,Now what can I do for you?,fru,2.5,2.0,2.5,1
Ses04M_script01_1_M024,[185.4754-195.6700]:,"I don't know why it is but every time I reach out for something I want, I have to pull back because other people will suffer.  My whole bloody life, time after time after time.",fru,2.0,2.0,3.0,1
Ses04M_script01_1_M025,[197.3400-199.2484]:,To hell with that.,fru,1.5,3.5,3.5,1
Ses04M_script01_1_M026,[201.1331-203.9000]:,I wanted to get this settled first.,neu,2.0,2.5,3.0,0
Ses04M_script01_1_F027,[203.0900-208.0920]:,How do you know she'll marry you?  Maybe she feels the same way father does.,neu,2.5,3.0,2.5,0
Ses04M_script01_1_F028,[218.9100-222.0700]:,"The trouble is, you don't see enough women.  You never did.",neu,2.5,3.0,2.5,0
Ses04M_script01_1_F029,[223.1500-225.7400]:,I don't see why it has to be Annie.,ang,2.0,3.5,3.5,2
Ses04M_script01_1_M029,[225.2800-227.1600]:,Because it is.,fru,1.5,4.5,3.5,1
Ses04M_script01_1_M030,[241.5700-243.8700]:,Line?,fru,2.5,2.0,2.5,1
Ses04M_script01_1_F031,[243.3600-244.9800]:,"Alright, then, mom.",fru,2.5,1.0,2.0,1
Ses04M_script01_1_M031,[246.6500-249.7974]:,"Alright, then, mom.  Did we skip something?  No.  Alright, then, mom.",neu,2.5,2.5,2.5,0
Ses04M_script01_1_F032,[249.4700-252.1500]:,Yes we did. Do you want to keep going?,neu,3.0,2.0,2.5,0
Ses04M_script01_1_M032,[251.6900-253.4800]:,"Yeah, let's keep going.",neu,3.0,2.0,2.0,0
Ses04M_script01_1_F033,[252.9400-255.1616]:,Just give it some more thought.,neu,2.5,3.0,2.5,0
Ses04M_script01_1_M033,[255.1616-260.9500]:,I've given it three years' of thought.  I'd hope that if,fru,2.0,3.5,3.5,1
Ses04M_script01_1_M034,[261.1541-273.2000]:,"father forgot about Larry, we'd have a regular wedding and everything happy.  If I can't get that here, then I'll have to get out.",sad,2.0,2.0,2.5,3
Ses04M_script01_1_F034,[272.6600-274.7000]:,What the hell is this?,ang,2.0,2.5,3.0,2
Ses04M_script01_1_F035,[281.7300-283.8190]:,Are you crazy?,ang,2.0,4.5,3.5,2
Ses04M_script01_1_M036,[283.3357-287.4800]:,I've been a good son too long; a good sucker.  I'm through with it.,fru,2.0,2.5,3.5,1
Ses04M_script01_1_F036,[286.6000-289.5900]:,You've got a business here.  What the hell is this?,ang,2.0,4.5,3.5,2
Ses04M_script01_1_M037,[288.1400-291.9500]:,The business?  The business doesn't inspire me.,ang,2.0,4.5,3.5,2
Ses04M_script01_1_F037,[291.2400-293.3300]:,Must you be inspired?,ang,2.0,4.5,3.5,2
Ses04M_script01_1_M038,[292.2700-299.9599]:,"Yes.  I like getting an hour a day.  If I have to grub for money all day long, at least at evening, I want it beautiful.",ang,2.0,4.0,3.5,2
Ses04M_script01_1_M040,[314.4800-317.3400]:,"Yes, on this I would.",neu,2.5,2.5,2.5,0
Ses04M_script01_1_F039,[316.6807-319.8702]:,You don't want to think like that.,ang,2.5,3.0,3.0,2
Ses04M_script01_1_M041,[319.3000-322.1899]:,Then you help me stay here.,neu,2.5,2.5,3.0,0
Ses04M_script01_1_F040,[321.7800-331.0700]:,"Alright.  But just don't think like that because what the hell did we work for?  That's all for you, Chris.  The whole shooting match is just for you.",ang,2.0,3.5,3.5,2
Ses04M_script01_1_M042,[330.0500-333.7300]:,I know that.  Just you help me stay here.,fru,2.0,2.5,3.0,1
Ses04M_script01_1_F041,[333.1700-335.7500]:,"But don't think that way, you hear me?",ang,2.0,3.5,3.5,2
Ses04M_script01_1_M044,[339.0800-342.8600]:,"No, you don't.  I'm a pretty tough guy.",fru,2.5,3.0,3.0,1
Ses04M_script01_2_F000,[005.6500-009.0000]:,Why did he invite her here?,ang,2.3333,2.3333,3.3333,2
Ses04M_script01_2_M000,[008.6133-011.4600]:,"Oh, God, line.",neu,2.6667,2.3333,2.0,0
Ses04M_script01_2_F001,[010.8600-012.7900]:,Why does that bother you?,neu,3.0,2.0,2.0,0
Ses04M_script01_2_F002,[013.8201-017.6200]:,"She's been in New York three and a half years.  Why, all of a sudden--",ang,2.6667,3.0,3.6667,2
Ses04M_script01_2_F003,[019.0400-022.9100]:,Nobody comes seven hundred miles just to see.,ang,2.3333,3.0,3.6667,2
Ses04M_script01_2_M003,[022.0200-029.7357]:,What do you mean?  He grew up next door to the girl all his life.  Why shouldn't he want to -- why shouldn't he want to see her again?,fru,2.3333,2.6667,3.3333,1
Ses04M_script01_2_F004,[033.8200-036.6600]:,He's not going to marry her.,ang,2.6667,2.6667,3.0,2
Ses04M_script01_2_M005,[035.9600-038.4000]:,How do you know he's even thinking about it?,neu,3.0,2.6667,2.3333,0
Ses04M_script01_2_F005,[037.7200-040.1382]:,It's got that about it.,ang,2.0,2.6667,3.3333,2
Ses04M_script01_2_M006,[040.0135-042.8574]:,Well so what?,neu,3.0,2.3333,3.0,0
Ses04M_script01_2_F006,[042.4333-045.3500]:,"What's going on here, Joe?",ang,2.3333,3.0,3.3333,2
Ses04M_script01_2_M007,[046.9000-048.0500]:,Line.,neu,3.0,2.0,2.3333,0
Ses04M_script01_2_F007,[047.7300-051.0200]:,"Now listen, kid. Now, listen.",neu,3.0,1.6667,2.0,0
Ses04M_script01_2_F008,[051.9627-055.6700]:,"She's not his girl, Joe.  She knows she's not.",ang,2.3333,3.0,3.6667,2
Ses04M_script01_2_F009,[057.2900-064.9800]:,"Then why is she still single?  New York is full of men.  Why hasn't she married?  Probably a hundred people told her she's foolish, but she's waited.",ang,2.0,3.0,3.6667,2
Ses04M_script01_2_F010,[065.8300-073.8404]:,"Because she knows what I know, that's why.  She's faithful as a rock.  In my worst moments, I think of her waiting and I know, again, that I'm right.",ang,2.6667,3.3333,3.6667,2
Ses04M_script01_2_M011,[073.3600-076.3600]:,"Look, it's a nice day.  What are we arguing for?",fru,2.3333,2.3333,2.6667,1
Ses04M_script01_2_F011,[075.4000-081.8600]:,"Nobody in this house dares take her faith away, Joe.  Strangers might, but not his father, not his brother.",ang,2.0,3.6667,3.6667,2
Ses04M_script01_2_M012,[081.5200-084.1700]:,What do you want me to do? What do you want?,fru,2.0,3.6667,3.6667,1
Ses04M_script01_2_F012,[083.6300-092.5500]:,"I want you to act like he's coming back, both of you.  Don't think I haven't noticed you since he invited her here.  I won't stand for any nonsense.",ang,2.0,3.6667,4.3333,2
Ses04M_script01_2_M013,[092.0700-094.1100]:,"But, Kate--",fru,2.0,3.3333,3.0,1
Ses04M_script01_2_F013,[093.5228-096.8656]:,"Because if he's not coming back, I'll kill myself.",ang,1.6667,4.0,4.0,2
Ses04M_script01_2_F014,[096.8905-102.3537]:,Laugh.  Laugh at me.  But why did that happen the very night that she came here?,ang,2.0,3.6667,3.3333,2
Ses04M_script01_2_F015,[102.3815-110.5000]:,She goes to sleep in his bed and his memorial breaks in pieces.  Look.  Look at it.  Joe--,ang,1.6667,4.3333,4.0,2
Ses04M_script01_2_M014,[110.0300-111.6000]:,Calm yourself.,fru,2.6667,2.3333,3.0,1
Ses04M_script01_2_F016,[111.0400-114.6900]:,"Believe with me, Joe.  I can't stand all alone",ang,2.0,2.6667,2.6667,2
Ses04M_script01_2_M015,[113.6300-115.5000]:,Calm yourself.,fru,3.3333,3.0,3.6667,1
Ses04M_script01_2_M016,[118.4400-120.8900]:,"Alright, alright.  Calm yourself.",fru,3.0,3.3333,3.6667,1
Ses04M_script01_2_F018,[120.3600-123.2800]:,"You, above all, have got to believe.  You.",ang,2.6667,3.3333,4.0,2
Ses04M_script01_2_M017,[122.5500-124.4700]:,Why me above all?,fru,2.0,3.0,3.0,1
Ses04M_script01_2_F020,[129.9900-131.8900]:,I can't help it.,sad,2.0,3.0,2.0,3
Ses04M_script01_2_M019,[132.4100-138.2511]:,"What have I got to hide?  What the hell is the matter with you, Kate?",ang,2.0,3.3333,3.3333,2
Ses04M_script01_3_F012,[112.8300-114.4500]:,Every day since.,hap,4.0,4.0,4.0,4
Ses04M_script01_3_F013,[115.3600-123.4100]:,"I was waiting for you, Chris.  'Til then, you never wrote and when you did, what did you say?  You sure can be ambiguous, you know.",hap,2.0,3.5,4.5,4
Ses04M_script01_3_F014,[133.3100-141.3504]:,I'll never forgive you.  Why did you wait all these years?  All I've done is sit around and wonder if I was crazy for thinking of you.,hap,3.0,4.0,4.5,4
Ses04M_script01_3_M022,[169.8100-174.8874]:,"Yes, I suppose there has been.  But it's going from me.",sad,2.0,2.0,3.0,3
Ses04M_script01_3_M023,[178.5700-181.6000]:,I don't know where to start.,sad,1.5,3.5,4.0,3
Ses04M_script01_3_M024,[184.3400-193.6441]:,"It's all mixed up with so many other things.  You remember overseas, I was in command of a company?",sad,2.5,2.5,3.5,3
Ses04M_script01_3_M025,[194.8445-198.8959]:,Well I lost them.,sad,2.0,2.5,3.5,3
Ses04M_script01_3_F022,[198.5208-201.2968]:,How many?,sad,2.0,3.0,3.0,3
Ses04M_script01_3_M026,[200.7716-203.2475]:,Just about all.,sad,2.0,3.0,3.0,3
Ses04M_script01_3_F023,[203.1725-205.4100]:,"Oh, gees.",sad,2.0,3.0,3.5,3
Ses04M_script01_3_M027,[206.7200-212.4758]:,It takes a little time to toss that off because they weren't just men.,sad,2.0,2.5,4.0,3
Ses04M_script01_3_M028,[212.5508-227.3600]:,"For instance, one time it'd been raining several days.  And this kid came to me and gave me his last pair of dry socks; put them in my pocket.  That's only a little thing, but that's the kind of guys I had.",sad,2.0,3.0,4.0,3
Ses04M_script01_3_M030,[239.0500-250.9300]:,"And I got this idea watching them go down, everything was being destroyed, see?  But, to me, it seemed there was one new thing that was made,",sad,2.0,3.0,4.0,3
Ses04M_script01_3_M031,[250.9900-262.5800]:,a kind of responsibility.  Man for man.  You understand me?  And then I went home and it was incredible.,sad,2.0,3.0,4.0,3
Ses04M_script01_3_M032,[262.9300-279.6400]:,"There was no meaning in it here.  The whole thing to them was some sort of bus accident.  Then I went to work for dad and that whole rat race again.  I felt, what you said, ashamed somehow",sad,2.0,3.0,4.5,3
Ses04M_script01_3_M033,[279.7700-290.2700]:,because nobody was changed.  It seemed to make suckers out of a lot of guys.  I felt wrong to be alive;,sad,2.0,2.5,4.5,3
Ses04M_script01_3_M034,[291.0600-305.6300]:,"to open that bank book; to drive the new car; to see the new refrigerator.  I mean, you can take these things out of a war, but when you drive the new car, you have to know that it came out of the love a man can have for a man.",sad,2.0,3.5,4.5,3
Ses04M_script01_3_M035,[306.5600-321.9100]:,"You have to be a little better because of that.  Otherwise, we have is really loot and there's blood on it.  I don't want to take any of it.  I guess that included you.",sad,2.0,3.0,4.0,3
Ses04M_script01_3_M037,[341.0400-344.6000]:,"Annie, Annie, I'm going to make you a fortune.",hap,3.5,3.5,4.0,4
Ses04M_script01_3_F027,[344.2400-346.8002]:,What'll I do with a fortune?,hap,4.0,3.5,3.5,4
Ses04M_script02_1_M001,[015.2900-021.5900]:,"Actually, I wanted to go a little farther up the coast, get away from the lights and the people, but I was afraid we'd miss it.  How you doing?",exc,3.5,2.5,2.5,6
Ses04M_script02_1_F000,[021.1400-022.9100]:,Fine.,neu,2.5,1.5,2.0,0
Ses04M_script02_1_M002,[022.8751-034.9200]:,"Is that, is that - is that just foam?  I can't even tell.  Although, if you can't tell, it's probably isn't them.  It'll probably be unmistakable, don't you think?",exc,4.0,4.0,2.5,6
Ses04M_script02_1_M003,[035.1100-043.5700]:,"How you doing?  Oh, no, you know what I did?  I forgot to bring my flashlight.  How could I be so stupid?  I should have brought my flashlight.",exc,3.0,3.0,2.5,6
Ses04M_script02_1_F002,[046.6500-048.5800]:,It's not yours.,ang,2.0,2.5,3.5,2
Ses04M_script02_1_M005,[048.3551-050.0000]:,Whose is it?,neu,2.5,2.0,2.0,0
Ses04M_script02_1_F003,[049.5200-052.2700]:,"It's ours.  It's mine, too.",ang,2.0,3.5,3.0,2
Ses04M_script02_1_M006,[051.8400-053.3280]:,"Well, sure.",fru,2.5,2.5,2.0,1
Ses04M_script02_1_F004,[052.8900-058.0000]:,You kept saying my flashlight as if it's somehow just yours.  How is that supposed to make me feel?,ang,2.0,4.0,3.0,2
Ses04M_script02_1_M008,[068.7200-073.4000]:,"I wonder, do they always run during a full moon? I can't remember if it was full last year.  Remember?",exc,3.5,2.5,2.0,6
Ses04M_script02_1_F005,[072.6800-074.0500]:,Yes.,ang,2.5,2.5,3.0,2
Ses04M_script02_1_M009,[073.7877-082.3600]:,"Are you cold?  Do you want my jacket?  We should have brought the blanket, our blanket.",neu,3.0,2.5,2.5,0
Ses04M_script02_1_M012,[106.8300-108.6900]:,You want my jacket?,neu,3.0,2.5,2.0,0
Ses04M_script02_1_F007,[108.1900-110.4921]:,It's after eleven; let's go home.,ang,2.0,3.0,2.5,2
Ses04M_script02_1_M013,[110.2000-115.5000]:,Are you kidding?  We'd miss it.  We just got here.  What's the point of coming down here if we just turn around and go home?,fru,2.0,3.5,2.5,1
Ses04M_script02_1_F008,[115.2100-117.3800]:,There is no point in coming down here.,ang,2.5,3.0,3.5,2
Ses04M_script02_1_M014,[117.1100-118.0100]:,Right.,neu,3.0,3.0,2.5,0
Ses04M_script02_1_F009,[117.5100-118.9223]:,That's my point.,fru,2.5,2.0,3.0,1
Ses04M_script02_1_M015,[118.5500-120.8200]:,"That's my point, too.",neu,2.5,2.5,2.0,0
Ses04M_script02_1_F010,[120.0700-121.8587]:,So let's go home.,ang,2.5,2.5,2.5,2
Ses04M_script02_1_M016,[121.6219-129.4000]:,"No, no, no.  That's not my point.  My point is is that there's no point in coming down here if we just leave.  Don't you want to see it?",fru,2.5,3.0,2.5,1
Ses04M_script02_1_F011,[129.0100-131.7097]:,Not particularly.,fru,2.0,3.5,2.5,1
Ses04M_script02_1_F012,[132.7516-135.5500]:,I just don't.  It's stupid.,ang,2.0,3.5,2.5,2
Ses04M_script02_1_M018,[135.3091-149.4000]:,"Honey, this is a natural phenomenon.  I mean, this only happens once a year.  It's a great opportunity.  Think about the people in Kansas.  They'd have to get plane tickets and hotel reservations to come see this.  We're just forty minutes away.  It's too good to pass up.",exc,2.5,3.5,2.5,6
Ses04M_script02_1_F013,[149.0700-156.2800]:,"Pass up what?  These little fish swim onto the beach, flop around and then they swim away.  And then they die.",ang,2.0,4.0,3.0,2
Ses04M_script02_1_M019,[155.7300-167.0880]:,"Yeah, but that moment on the beach is the highlight of their little lives.  I mean, all that flopping around is laying eggs or what do you -- spawning or mating, something like that.",fru,3.0,3.0,2.5,1
Ses04M_script02_1_M020,[167.6000-170.9900]:,There's mystery here and magic.,exc,3.0,2.5,2.5,6
Ses04M_script02_1_F014,[176.8200-179.0200]:,What are you so excited about?,neu,2.0,3.0,3.0,0
Ses04M_script02_1_M021,[173.0554-177.2232]:,"Oh, it's a big night for these guys.  Uh, life's last orgy.",exc,3.5,2.5,2.5,6
Ses04M_script02_1_F015,[179.0500-183.7200]:,This isn't a moon landing we're talking about.  It's fish.  It's fish nobody even eats.,fru,2.0,3.5,3.0,1
Ses04M_script02_1_M022,[183.1200-193.3300]:,"Yeah, they do. Okay.  But it's fish who do something none of the other fish do; like the swallows are returning to Capistrano; or the lemmings throwing themselves off the cliffs, like that.",exc,3.0,3.0,2.5,6
Ses04M_script02_1_M023,[193.3900-201.3200]:,There's mystery here and magic; a little bit of the unexplainable.  I don't see how you can not be interested.,exc,2.5,3.0,2.5,6
Ses04M_script02_1_F016,[200.8100-203.1767]:,I'm just not.,fru,2.5,2.5,2.5,1
Ses04M_script02_1_M024,[202.4663-204.3134]:,For real?,sur,2.5,3.0,2.0,5
Ses04M_script02_1_F017,[204.0766-205.5448]:,Yes.,ang,2.5,3.5,3.0,2
Ses04M_script02_1_F018,[218.7400-228.8935]:,"Last year, you will also remember, our shoes got wet.  I got sand in my panties.  We got into a big fight over nothing.  You got a sore throat and we did not see the grunions.",ang,2.5,3.5,3.5,2
Ses04M_script02_1_F019,[230.9900-233.9600]:,We didn't see them the first time either.,fru,2.0,3.0,3.0,1
Ses04M_script02_1_M028,[244.3200-258.6359]:,"no, it's just seaweed, isn't it?  Oh, man, this is great.  I wouldn't miss this for anything.  I mean, think about this.  I know you're not interested, but just think about this for a minute.",exc,3.5,3.0,2.5,6
Ses04M_script02_1_M029,[258.7307-271.7548]:,Out there someplace is this huge mass of silver fish heading this way.  They don't know why.  We don't know why.  It wasn't a decision.  They didn't take a vote.  No one sent them an invitation or a map;,exc,3.0,3.0,2.5,6
