Session_ID,Time_Record,Transcription,Sentiment,Valence,Activation,Dominance,discrete
Ses02F_script01_1_F024,[179.6600-187.6800]:,and you can go on from there if you know where to go but i don t know where to go see i don t know now what can i do for you,fru,2.0,3.5,4.5,1
Ses02F_script01_1_M024,[187.6800-200.6209]:,i don t know why but every time i reach out for something that i want i have to pull back cause someone else will suffer my whole bloody life time after time after time,fru,1.5,3.5,4.5,1
Ses02F_script01_1_F025,[199.5300-202.2400]:,you re a considerate fellow there s nothing wrong with that,neu,3.5,2.0,3.0,0
Ses02F_script01_1_M025,[201.9800-203.3600]:,to hell with that,ang,1.5,3.0,4.0,2
Ses02F_script01_1_F026,[203.2237-206.3000]:,breathing have you asked annie yet,neu,2.5,3.5,3.5,0
Ses02F_script01_1_F027,[208.3300-212.7334]:,well how do you know she ll marry you maybe she feel the same way your father doe,neu,2.5,3.0,3.0,0
Ses02F_script01_1_M027,[212.7000-225.6616]:,well if she doe then that s the end of it but from her letter i think she s forgotten him i ll find out and then we ll thrash it out with dad right mom don t avoid me,sad,2.0,3.0,4.0,3
Ses02F_script01_1_F028,[225.0100-227.9200]:,trouble is you don t see enough woman,sad,2.0,3.5,3.5,3
Ses02F_script01_1_F029,[227.9500-229.4970]:,you never did,fru,2.0,3.0,3.5,1
Ses02F_script01_1_F030,[231.1923-234.0509]:,i just don t see why it ha to be annie,fru,2.0,4.0,4.0,1
Ses02F_script01_1_M029,[234.3900-235.9700]:,because it is,neu,3.0,2.5,3.5,0
Ses02F_script01_1_F031,[236.3101-244.8300]:,well that s a good answer but it doesn t answer anything i mean you ve been away for at war it s been five year,fru,2.0,3.0,4.0,1
Ses02F_script01_1_M031,[249.5400-253.7100]:,these year when i think of a wife i think of annie what do you want a diagram,fru,2.5,3.5,3.5,1
Ses02F_script01_1_F032,[252.9100-261.3100]:,i don t want a diagram umm he think he s coming back chris you marry that girl and you re pronouncing him dead,fru,1.5,4.0,4.5,1
Ses02F_script01_1_F033,[261.3300-264.8800]:,i mean what s gonna happen to your father do you know i don t,fru,2.0,3.5,4.5,1
Ses02F_script01_1_M032,[263.8700-265.8200]:,all right all right then mom,fru,2.5,3.0,3.5,1
Ses02F_script01_1_F034,[265.5800-268.2700]:,i just give it some more thought,fru,1.5,4.0,3.5,1
Ses02F_script01_1_M033,[268.0638-277.8066]:,i ve given it three year of thought i thought that if i waited dad would forget about larry and we could have a regular wedding and everything happy,fru,2.0,4.0,4.0,1
Ses02F_script01_1_F035,[281.7400-283.6600]:,what the hell is this,sur,2.0,2.5,4.0,5
Ses02F_script01_1_F036,[289.0800-290.7700]:,are you crazy,ang,1.5,3.5,4.0,2
Ses02F_script01_1_M036,[290.2700-293.5400]:,i ve been a good son too long a good sucker i m through with it,ang,1.5,4.0,4.5,2
Ses02F_script01_1_F037,[293.3600-295.8800]:,what about the business what the hell is this,ang,2.0,4.5,4.5,2
Ses02F_script01_1_M037,[295.5400-298.9900]:,the business the business doesn t inspire me,ang,1.5,3.5,4.0,2
Ses02F_script01_1_F038,[298.4100-300.5800]:,must you be inspired,ang,1.5,3.5,4.0,2
Ses02F_script01_1_M038,[299.3700-306.8400]:,yes i like it an hour a day if i m gonna grub for my money all day long at least in the evening i want it beautiful,ang,1.5,4.0,4.5,2
Ses02F_script01_1_M040,[319.9700-322.4800]:,yes on this i would,neu,2.5,2.5,4.0,0
Ses02F_script01_1_F040,[322.4900-325.8319]:,well you don t want to think like that,ang,1.5,3.5,3.5,2
Ses02F_script01_1_M042,[335.1600-338.9700]:,i know i know mom just help me stay here,fru,2.5,3.5,4.0,1
Ses02F_script01_1_F042,[339.2600-343.7600]:,all right just just don t go thinkin that way you hear me,fru,1.5,3.5,4.0,1
Ses02F_script01_1_M043,[343.3500-345.6700]:,i am thinkin that way,neu,2.5,2.5,4.0,0
Ses02F_script01_1_F043,[346.5600-349.8700]:,i don t understand you do i,fru,2.0,2.0,3.0,1
Ses02F_script01_1_M044,[350.0500-353.4300]:,no you don t i m a pretty tough guy,neu,2.5,2.5,3.5,0
Ses02F_script01_1_F044,[353.5200-356.2000]:,i can see that,sad,3.5,2.0,2.5,3
Ses02F_script01_2_M001,[012.5300-015.6600]:,well maybe he just wanted to see her again,neu,3.0,3.3333,3.0,0
Ses02F_script01_2_M002,[018.6200-024.2000]:,what do you mean he lived next door to the girl all his life why wouldn t he want to see her again,neu,3.0,2.6667,3.3333,0
Ses02F_script01_2_M004,[030.2300-032.5100]:,how do you know he s even thinking of it,neu,2.6667,2.6667,2.6667,0
Ses02F_script01_2_F005,[032.3100-034.4600]:,it s got that all about it,ang,2.3333,3.3333,3.6667,2
Ses02F_script01_2_M005,[035.8900-037.6100]:,well so what,neu,3.0,2.6667,2.0,0
Ses02F_script01_2_M006,[039.0100-040.9000]:,now listen kate,neu,3.0,2.6667,2.6667,0
Ses02F_script01_2_M007,[042.9200-044.8600]:,you can t read her mind,neu,3.0,2.0,3.0,0
Ses02F_script01_2_F008,[044.5200-053.5100]:,well then why is she still single i mean new york is full of men why isn t she married probably a hundred people told her she s crazy but she s waited,fru,2.3333,3.3333,3.0,1
Ses02F_script01_2_M008,[053.2100-055.5600]:,how do you know why she s waited,neu,2.6667,1.6667,2.6667,0
Ses02F_script01_2_F009,[054.7100-063.7600]:,she know what i know that s why she s faithful a a rock in my worst moment i think of her waiting and i know again that i m right,fru,2.3333,3.3333,4.0,1
Ses02F_script01_2_M009,[063.9200-066.8200]:,look it s a nice day what are we arguing for,fru,3.0,3.0,2.6667,1
Ses02F_script01_2_M010,[074.4300-076.6800]:,well what do you want me to do about it,fru,2.6667,3.0,2.6667,1
Ses02F_script01_2_F011,[075.5000-084.1200]:,i want you to act like he s coming back both of you don t you think i haven t noticed since she got here i won t stand for any nonsense,fru,1.6667,4.0,3.6667,1
Ses02F_script01_2_M011,[083.8000-085.0700]:,but kate,fru,3.0,2.3333,2.6667,1
Ses02F_script01_2_F012,[084.7600-090.0000]:,because if he s not coming back i ll kill myself i mean laugh laugh at me but,ang,1.6667,3.6667,3.6667,2
Ses02F_script01_2_F013,[090.0300-097.2500]:,but why did that happen the very night she came here she sleep in his room and his memorial break to piece just look look at it,ang,1.6667,4.0,3.6667,2
Ses02F_script01_2_M012,[095.7600-097.4300]:,calm yourself,fru,3.0,2.6667,4.0,1
Ses02F_script01_2_F014,[097.2700-100.9500]:,believe with me joe i can t stand all alone,fru,1.3333,3.3333,3.3333,1
Ses02F_script01_2_M013,[100.2100-102.1200]:,calm yourself,fru,3.0,2.3333,3.0,1
Ses02F_script01_2_F015,[100.9600-106.1200]:,last week a man turned up in detroit missing longer than larry i mean you read it yourself,fru,2.0,4.0,3.0,1
Ses02F_script01_2_M014,[104.9000-107.8200]:,all right all right calm yourself,fru,3.0,3.0,3.6667,1
Ses02F_script01_2_F016,[106.2700-109.4800]:,you above all have to believe,fru,2.0,3.3333,3.6667,1
Ses02F_script01_2_F017,[111.1900-114.2492]:,just just don t stop believing,fru,2.0,2.3333,2.3333,1
Ses02F_script01_2_M016,[114.0000-116.5000]:,what doe that mean me above all,ang,1.6667,3.3333,3.3333,2
Ses02F_script01_2_M017,[116.6100-118.9300]:,look at you look at you shaking,ang,1.6667,3.0,4.0,2
Ses02F_script01_2_F018,[117.9700-119.8700]:,i can t help it,fru,1.6667,3.3333,3.0,1
Ses02F_script01_2_M018,[119.4300-123.8900]:,what have i got to hide what the hell is the matter with you kate,ang,2.0,3.0,4.0,2
Ses02F_script01_3_M001,[019.3800-021.0300]:,you re not sorry you came,neu,3.5,2.5,2.5,0
Ses02F_script01_3_F009,[061.5400-064.1200]:,from her point of view why else would i come,sad,3.0,3.0,3.5,3
Ses02F_script01_3_M010,[100.4000-109.9300]:,you feel it s wrong here don t you this yard this chair i want you to be ready for me i don t want to have to win you away from anything,exc,3.0,3.0,4.0,6
Ses02F_script01_3_F012,[115.7900-118.5420]:,i almost got married two year ago,hap,3.5,2.5,2.5,4
Ses02F_script01_3_F013,[121.0300-123.4500]:,you started to write me and,hap,4.0,3.0,2.5,4
Ses02F_script01_3_F014,[124.8200-126.7000]:,every day since,hap,4.5,3.0,3.5,4
Ses02F_script01_3_F016,[146.2400-154.8400]:,i will never forgive you why did you wait all these year all i did wa sit and wonder if i wa crazy for thinking of you,hap,4.5,5.0,4.5,4
Ses02F_script01_3_M020,[173.5779-176.7000]:,no nothing like that,sad,2.0,2.5,3.5,3
Ses02F_script01_3_F020,[176.8257-185.9200]:,then what s wrong i mean even in your letter there wa some something ashamed,sad,2.5,2.0,3.5,3
Ses02F_script01_3_M021,[186.5800-191.1500]:,yeah i suppose i have been but it s going from me,sad,3.0,2.0,3.5,3
Ses02F_script01_3_F021,[191.1300-193.3241]:,you ve gotta tell me,sad,3.0,3.5,3.5,3
Ses02F_script01_3_M022,[193.8700-196.2000]:,i don t know how to start,sad,2.0,2.5,3.5,3
Ses02F_script01_3_F022,[196.6900-198.6400]:,it wouldn t work this way,sad,2.0,2.0,3.0,3
Ses02F_script01_3_M023,[200.0900-207.2400]:,it s all mixed up with so many other thing you remember overseas i wa in command of a company,sad,2.5,2.5,3.5,3
Ses02F_script01_3_F023,[206.9900-208.4100]:,yeah sure,sad,3.5,2.0,2.5,3
Ses02F_script01_3_M024,[209.2300-211.3800]:,well i lost them,sad,2.0,2.5,3.0,3
Ses02F_script01_3_F024,[211.6000-213.3000]:,how many,sad,3.0,2.5,2.5,3
Ses02F_script01_3_M025,[214.0700-215.6400]:,just about all,sad,2.0,2.0,3.0,3
Ses02F_script01_3_F025,[215.8937-217.6679]:,oh gee,sad,2.0,2.0,3.0,3
Ses02F_script01_3_M026,[218.0900-223.2800]:,it take some time for a guy to toss that off cause they weren t just men,sad,2.5,3.0,4.0,3
Ses02F_script01_3_M027,[224.1600-238.3000]:,for instance one time it had been raining several day and this kid came to me and gave me his last pair of dry sock i put them in pocket it s only a little thing but that s the kind of guy i had,sad,3.0,3.5,4.0,3
Ses02F_script01_3_M028,[238.3700-247.3600]:,they didn t die they killed themselves for each other i mean that exactly a little more selfish and they d have been here today,sad,2.0,3.0,4.0,3
Ses02F_script01_3_M029,[247.9400-261.6500]:,i got this idea watching them go down everything wa being destroyed see but it seemed that there wa one new thing being made a sort of responsibility man for man,sad,3.0,3.5,5.0,3
Ses02F_script01_3_M030,[261.6900-273.3400]:,you know what i mean to show that to bring that onto the earth again like some kind of monument and everyone would feel it standing behind him and it would make a difference to him,sad,3.0,4.0,5.0,3
Ses02F_script01_3_M031,[274.7500-290.0600]:,then i came back and it wa incredible there wa no meaning in it here the whole thing to them seemed like sort of a bus accident i went to work with dad and that rat race again,sad,2.0,3.0,4.5,3
Ses02F_script01_3_M032,[290.3500-307.6700]:,and i felt what you said ashamed somehow cause nobody wa changed at all it seemed to make sucker out of a lot of guy i felt wrong to be alive to open the new bank book drive the new car see the new refrigerator,sad,2.0,3.0,4.5,3
Ses02F_script01_3_M033,[308.7100-320.4500]:,i mean you can take those thing out of a war but when you drive that car you ve gotta know that it came out of the love a man can have for a man you ve gotta be a little better because of it,sad,3.0,3.0,4.5,3
Ses02F_script01_3_M034,[320.8300-330.7300]:,because otherwise all you have is really loot and there s blood on it and i didn t want to take any of it and i guess that included you,sad,2.0,3.0,4.5,3
Ses02F_script01_3_F026,[331.4300-333.6900]:,you still feel that way,sad,2.5,2.0,2.5,3
Ses02F_script01_3_F029,[357.6900-360.0600]:,what ll i do with a fortune,hap,4.5,3.5,3.5,4
Ses02F_script02_1_M000,[005.2900-008.8900]:,what time is it they re supposed to run around midnight,exc,3.5,3.0,3.5,6
Ses02F_script02_1_M001,[008.9000-013.0300]:,this is great isn t it look at the night we ve got here couldn t be better,exc,4.0,3.5,4.0,6
Ses02F_script02_1_M002,[013.0700-019.1800]:,i would have liked to have gone a little further up the coast to get away from the light and the people but i wa afraid we d miss it,exc,3.0,3.5,3.5,6
Ses02F_script02_1_M003,[019.2200-020.3100]:,how you doing,exc,4.0,3.0,3.5,6
Ses02F_script02_1_M004,[021.4000-026.6500]:,is that no is that just foam i can t even tell,exc,3.0,2.5,3.5,6
Ses02F_script02_1_M005,[026.6900-031.4300]:,well i guess we can tell it probably isn t right probably be unmistakable don t you think,exc,4.0,3.5,3.5,6
Ses02F_script02_1_M006,[031.4700-039.6900]:,how you doing aw you know what i forgot i forgot to bring my flashlight oh how could i be so stupid i should ve brought my flashlight,exc,3.0,4.0,4.0,6
Ses02F_script02_1_F001,[039.3900-040.5700]:,what flashlight,neu,2.0,2.5,3.0,0
Ses02F_script02_1_M009,[049.0100-050.5000]:,oh well sure,neu,2.5,2.5,2.0,0
Ses02F_script02_1_M010,[055.3700-062.4000]:,right of course our flashlight mine and yours i mean me flashlight is su flashlight naturally,neu,3.5,3.5,4.0,0
Ses02F_script02_1_M012,[068.1500-072.9000]:,i wonder do they always run during a full moon i can t remember if it wa full last year do you remember,neu,3.0,3.0,3.5,0
Ses02F_script02_1_F005,[072.6900-073.9700]:,yeah,neu,3.0,2.0,2.5,0
Ses02F_script02_1_M013,[074.1600-079.7100]:,you cold do you want my jacket oh we should ve brought the blanket our blanket,neu,4.0,3.5,4.0,0
Ses02F_script02_1_M014,[080.2700-085.8500]:,this is great isn t it a six pack would be just the ticket right now,exc,4.0,3.0,4.0,6
Ses02F_script02_1_M015,[085.9000-091.2500]:,i can t believe i forgot i m like a kid it s amazing i got out of the house with my fly zipped,exc,4.0,4.0,4.0,6
Ses02F_script02_1_M016,[093.4500-098.2100]:,you think they can hear u talk or feel the vibration in the sand when we move around,exc,3.0,3.0,4.5,6
Ses02F_script02_1_M017,[100.6000-102.0300]:,do you want my jacket,neu,2.5,3.5,3.0,0
Ses02F_script02_1_F007,[102.2100-104.8400]:,it s after eleven let s just go home,fru,2.0,2.5,3.5,1
Ses02F_script02_1_M019,[113.3000-114.1900]:,right,neu,3.5,2.5,2.5,0
Ses02F_script02_1_M020,[115.1000-116.6000]:,that s my point too,neu,3.5,2.5,3.0,0
Ses02F_script02_1_M021,[117.8300-124.5900]:,no no that s not my point the point is there s no point in coming down if we just leave don t you want to see it,neu,2.5,3.0,4.0,0
Ses02F_script02_1_M024,[136.8900-143.8500]:,think about the people in kansa they had to get plane ticket and hotel reservation to see this we live forty minute away it s too good to pa up,exc,4.0,3.5,4.0,6
Ses02F_script02_1_F013,[143.1900-150.1900]:,pa up what these little fish swim onto the beach they flop around and swim away and then they die,fru,2.0,4.0,4.5,1
Ses02F_script02_1_M025,[149.6700-159.0000]:,yeah but that moment on the beach is the highlight of their little life all that flopping is laying egg or what do you spawning or mating i mean,exc,3.5,4.0,4.0,6
Ses02F_script02_1_M026,[159.0500-162.0100]:,this is a big night for these guy life s last orgy,exc,3.0,3.5,4.5,6
Ses02F_script02_1_F014,[161.3900-168.6000]:,what are you so excited about i mean it s not a moon landing we re talking about here it s fish it s a fish nobody even eats,fru,2.0,2.5,3.5,1
Ses02F_script02_1_M027,[168.7200-170.3500]:,yeah they do,fru,3.5,3.5,3.5,1
Ses02F_script02_1_F015,[169.8600-171.2700]:,ah augie,fru,2.0,2.5,3.5,1
Ses02F_script02_1_M028,[171.2300-179.6300]:,alright but it s fish that do something that none of the other fish do like the swallow returning to capistrano or the lemming throwing themselves off the cliff,exc,3.5,3.5,4.0,6
Ses02F_script02_1_F016,[185.8000-187.5400]:,i m just not,fru,2.0,3.0,3.5,1
Ses02F_script02_1_M031,[190.2800-194.7800]:,i don t get it the first time we came here you said it wa the best night of your life,neu,2.5,4.0,4.0,0
Ses02F_script02_1_F018,[201.7700-211.4700]:,last year you will also remember our shoe got wet i got sand in my panty you got a sore throat we got in a big fight over nothing and we didn t see the grunions,fru,2.0,4.0,4.0,1
Ses02F_script02_1_M033,[211.4300-213.0800]:,we weren t in a good spot,neu,2.5,3.0,3.0,0
Ses02F_script02_1_F019,[212.7100-214.9300]:,we didn t see them the first time either,neu,2.5,3.0,3.0,0
Ses02F_script02_1_M035,[220.6300-225.0800]:,there is that no that s just seaweed isn t it,exc,2.5,3.5,3.5,6
Ses02F_script02_1_M036,[225.1400-233.2600]:,oh man this is great isn t it i wouldn t miss this for anything here think about this all right i know you re not interested but think about this,exc,4.0,4.0,4.0,6
Ses02F_script02_1_M039,[247.1700-261.5400]:,all a one this time release instinctual little firecracker went off and they all turned and formed a line a long a the california coast and started swimming and they re swimming right now a if that s all that matter,exc,3.5,4.0,4.5,6
Ses02F_script02_1_M040,[261.7400-271.7000]:,it s like single mindedness with no mind it s urgency that s pure urge they don t know what drive them they don t ask it a question or give it a name,exc,3.5,3.5,4.5,6
Ses02F_script02_1_M041,[271.7100-280.1800]:,they just turn a one and start the swim that brings them right here to where we stand for a massive celebration of sex and death,exc,4.0,3.5,4.5,6
Ses02F_script02_1_M042,[280.2100-284.6400]:,ah god i m giving myself goose bump look all my hair are popped up,exc,4.0,4.0,3.5,6
Ses02F_script02_1_M043,[285.9500-287.8700]:,well so what do you think,neu,3.0,3.0,3.0,0
Ses02F_script02_1_F021,[287.6800-289.1700]:,about what,neu,3.5,2.0,3.0,0
Ses02F_script02_1_M044,[288.8000-290.2900]:,what i wa saying,neu,3.0,3.0,3.0,0
Ses02F_script02_2_M000,[004.2700-006.3631]:,well so what do you think,exc,3.5,3.5,3.5,6
Ses02F_script02_2_F000,[006.3300-007.7200]:,about what,neu,2.5,2.0,2.5,0
Ses02F_script02_2_M001,[007.7600-009.0700]:,what i wa saying,neu,3.0,3.5,3.0,0
Ses02F_script02_2_F001,[009.5015-011.2600]:,it s ridiculous,fru,2.5,3.5,2.5,1
Ses02F_script02_2_M002,[011.4400-015.5300]:,it certainly is not it s slightly exaggerated scientific fact,neu,2.5,3.5,4.0,0
Ses02F_script02_2_M003,[021.2400-023.6600]:,well i m not the only one look at all these people,neu,2.5,3.5,3.0,0
Ses02F_script02_2_M005,[038.7300-045.5600]:,carla can i ask you something don t take this wrong but are you having your period,neu,3.0,3.0,2.5,0
Ses02F_script02_2_F005,[045.2100-052.6500]:,god damn it augie don t ask me that i hate it when you ask me that you always ask me that it s insulting,ang,1.5,4.5,4.5,2
Ses02F_script02_2_M006,[051.7900-053.5100]:,well what s bugging you,fru,2.5,3.5,4.0,1
Ses02F_script02_2_F006,[053.2000-057.7000]:,we just have different idea of what this evening is supposed to look like,ang,2.0,4.0,4.0,2
Ses02F_script02_2_M007,[057.5500-067.7200]:,there s nothing to it we come here the grunion arrive they do their little fish business we go ooh ah look at the fish they go home we go home,neu,2.5,4.0,4.0,0
Ses02F_script02_2_F007,[067.3100-070.9800]:,for heaven sake we re not going to see the grunions,fru,1.5,4.0,3.5,1
Ses02F_script02_2_M008,[070.6700-072.0900]:,why not,fru,2.5,3.0,3.0,1
Ses02F_script02_2_F008,[071.7500-075.2300]:,we never do do we i mean have we ever,fru,2.0,4.0,3.5,1
Ses02F_script02_2_M009,[075.0400-077.4500]:,we ve missed them twice that s not ever,neu,2.0,3.0,3.0,0
Ses02F_script02_2_F009,[076.8900-079.7300]:,twice is every time we ve tried that s ever,fru,2.0,3.5,4.0,1
Ses02F_script02_2_M010,[079.4000-081.1300]:,well we ll see them this year,neu,2.5,3.5,3.5,0
Ses02F_script02_2_F010,[080.7700-086.1500]:,no we won t it s pointless it s like waiting up to see santa claus,fru,2.0,4.0,4.5,1
Ses02F_script02_2_F011,[086.1600-099.7100]:,i mean i feel like my whole life is gonna be spent standing on the beach with my eye wide open and my hand clasped expectantly waiting for the fish to show up and the fish won t show up,ang,1.5,5.0,5.0,2
Ses02F_script02_2_M011,[099.6700-101.5000]:,i thought you wanted to see it,fru,2.5,2.5,2.5,1
Ses02F_script02_2_F012,[101.2800-103.8100]:,you don t understand anything i m saying,fru,2.0,3.5,3.5,1
Ses02F_script02_2_M012,[103.5800-105.1700]:,no of course not,fru,1.5,3.0,4.0,1
Ses02F_script02_2_F013,[104.9300-111.9000]:,i did want to see it i always do i keep thinking that this is gonna be the time and it never is,fru,1.5,4.0,4.5,1
Ses02F_script02_2_M013,[111.4600-114.7500]:,it s just fish nothing to get traumatized about,neu,2.5,3.0,3.5,0
Ses02F_script02_2_M014,[115.9200-124.0800]:,all right look i ve been trying to work this backwards but i cannot seem to figure out the exact moment that we took a turn for the worst,fru,2.0,4.0,3.5,1
Ses02F_script02_2_M016,[134.1000-138.8100]:,you said hey the grunion are running tonight i said great let s go i feel lucky,neu,3.0,4.0,4.0,0
Ses02F_script02_2_M017,[138.8600-144.9200]:,okay so i m putting on my jacket putting out the animal getting the car out of the garage,neu,3.0,4.0,3.5,0
Ses02F_script02_2_F015,[143.6900-149.7200]:,do you remember the first time we came to see it it wa about four year ago right after we got married,sad,2.5,3.0,4.0,3
Ses02F_script02_2_F016,[149.7400-159.7600]:,i thought i wa pregnant you had a bottle of champagne but no glass you asked me to dance so we kicked off our shoe and you popped the cork,sad,4.0,4.0,3.5,3
Ses02F_script02_2_F017,[159.7833-169.3200]:,and while we were dancing you said the softest most intimate thing to me right into my ear so that i could feel them a much a hear them,sad,3.5,4.0,4.5,3
Ses02F_script02_2_F018,[169.3400-178.1700]:,and i remember thinking this is it you know at last at last i am a happy a i am supposed to be,sad,4.0,4.5,4.0,3
Ses02F_script02_2_M018,[177.5600-179.3800]:,wait a minute i ve got it,neu,4.0,3.5,3.5,0
Ses02F_script02_2_F019,[178.7800-183.3300]:,just dancing barefoot in the sand drinking champagne out of the bottle,sad,4.0,4.0,4.0,3
Ses02F_script02_2_M019,[183.1800-192.2200]:,it wa in the car right driving past the knickerbocker liquor locker you said let s get some champagne and i said time s a wasting or something like that right,neu,3.0,4.0,4.0,0
Ses02F_script02_2_M020,[192.2500-197.0700]:,yeah of course i see it now you want this to be like that other time right that s it right,neu,3.0,4.0,4.0,0
Ses02F_script02_2_F020,[196.7300-202.0100]:,i d rather not remember some thing i would rather not hope for some thing,sad,2.5,3.0,3.5,3
Ses02F_script02_2_M021,[201.3200-206.7400]:,okay yeah sure i see it now listen you wanna dance,neu,3.0,3.5,3.5,0
Ses02F_script02_2_F021,[206.4100-207.5500]:,no,sad,2.5,2.0,2.5,3
Ses02F_script02_2_M022,[207.5100-209.4900]:,you want me to go get some champagne,neu,3.0,3.5,3.0,0
Ses02F_script02_2_F022,[208.7400-209.7200]:,no,sad,2.5,2.5,2.0,3
Ses02F_script02_2_M023,[209.5700-211.3200]:,take off our shoe,neu,3.0,3.5,2.5,0
Ses02F_script02_2_M024,[211.3900-213.9400]:,well what you want me to breathe in your ear,fru,2.0,3.5,2.5,1
Ses02F_script02_2_F024,[213.2000-214.0700]:,no,sad,2.0,2.0,2.5,3
Ses02F_script02_2_M025,[213.9900-215.8600]:,you wanna get married again,fru,3.0,3.5,2.5,1
Ses02F_script02_2_F025,[215.2100-216.2000]:,no,fru,2.5,2.0,2.5,1
Ses02F_script02_2_M026,[215.9000-218.3600]:,what what you want a divorce,fru,2.0,3.5,3.0,1
Ses02F_script02_2_F026,[217.4100-218.6800]:,no,fru,2.0,3.5,3.5,1
Ses02F_script02_2_M027,[218.4100-219.7400]:,a vacation,fru,2.0,3.5,3.5,1
Ses02F_script02_2_F027,[218.9300-220.1400]:,no,fru,2.0,4.0,4.0,1
Ses02F_script02_2_M028,[219.7500-226.5400]:,a new carpet a poodle ice cream back rub a suicide pact what what carla what the hell do you want,fru,2.0,4.0,4.0,1
Ses02F_script02_2_M029,[228.2000-238.9600]:,well welcome to the human race do you think this is what i had in mind when i proposed that four year down the road we d be at the beach yelling at each other over fish,ang,2.0,4.5,4.5,2
Ses02F_script02_2_M031,[250.8900-266.4300]:,no carla i m just like you i thought it wa gonna be all peach and rose and sand in our toe and wind in our hair and the fish will always come and the bill will pay themselves and we ll have three fat rosy kid and ha ha baby the joke s on u,sad,2.5,3.0,4.0,3
Ses02F_script02_2_M032,[266.4400-269.3900]:,cause you know what you get carla you know what you get this,fru,2.0,3.5,4.0,1
Ses02F_script02_2_M033,[273.8200-275.0800]:,yes it is,neu,3.0,2.5,3.0,0
Ses02F_script02_2_M034,[280.1300-281.2200]:,right,neu,2.5,2.5,4.0,0
Ses02F_script02_2_F031,[281.5765-286.6000]:,well this isn t anything like i thought anything would be like,sad,1.5,4.0,3.5,3
Ses02F_script02_2_M035,[286.3300-288.2900]:,i know me neither,sad,2.5,3.0,3.0,3
Ses02F_script02_2_M036,[302.9300-305.0600]:,i m doing the best i can,sad,2.0,2.5,3.5,3
Ses02F_script02_2_F033,[305.3800-308.7200]:,i know that augie really i do,sad,2.5,3.5,3.0,3
Ses02F_script02_2_F034,[308.7500-324.1000]:,i know that you meant this to be special and nice and the sand and the moon and all but i just couldn t help thinking about being somewhere else,sad,1.5,3.0,3.5,3
Ses02F_script02_2_M037,[325.0600-327.9300]:,maybe if you were with somebody else too,sad,2.0,2.5,3.5,3
Ses02F_script02_2_F035,[327.1500-328.7700]:,i didn t say that,sad,2.0,2.0,2.5,3
Ses02F_script02_2_M038,[328.3800-333.7100]:,no i know but still i know i don t make you happy,sad,2.0,3.0,3.0,3
Ses02F_script02_2_M039,[337.8400-339.0300]:,yeah,sur,3.0,2.5,3.0,5
Ses02F_script02_2_F038,[342.0800-350.2000]:,you re the one who probably wish you were with someone else someone who you d rather enjoy yourself and didn t take everything so hard,sad,1.5,3.0,4.5,3
Ses02F_script02_2_M041,[364.8100-370.5600]:,i don t know it seemed like a pretty good spot to me i mean look at the view you have of the moon from here,hap,4.0,3.0,3.0,4
Ses02F_script02_2_M042,[378.2800-380.2100]:,well look what we have here,hap,4.0,3.5,3.5,4
Ses02F_script02_2_F041,[379.8700-382.7600]:,augie you brought refreshment,hap,4.0,4.0,3.5,4
Ses02F_script02_2_M043,[382.4300-384.0800]:,it s not champagne,hap,4.0,3.0,3.0,4
Ses02F_script02_2_F042,[383.7000-387.6000]:,well then we don t need glass,hap,4.0,3.0,3.5,4
Ses02F_script02_2_F043,[393.4100-402.2600]:,no i think you might be right maybe this is the spot after all,hap,4.0,3.0,3.5,4
Ses02F_script02_2_F044,[405.9300-408.2600]:,augie i m sorry,sad,2.5,3.5,3.5,3
